14:45:55.333587 IP 5.6.7.8.80 > 1.1.2.3.34829: Flags [S.], seq 245540612, ack 1673023165, win 29200, options [mss 1460], length 0
14:45:55.333617 IP 1.1.2.3.34829 > 5.6.7.8.80: Flags [R], seq 1673023165, win 0, length 0
14:46:42.733537 IP 5.6.7.8.80 > 1.1.2.3.58799: Flags [S.], seq 121195649, ack 1581149928, win 29200, options [mss 1460], length 0
14:46:42.733565 IP 1.1.2.3.58799 > 5.6.7.8.80: Flags [R], seq 1581149928, win 0, length 0
14:46:56.333538 IP 5.6.7.8.80 > 1.1.2.3.61314: Flags [S.], seq 1517578051, ack 806874062, win 29200, options [mss 1460], length 0
14:46:56.333561 IP 1.1.2.3.61314 > 5.6.7.8.80: Flags [R], seq 806874062, win 0, length 0
14:48:14.471096 IP 1.1.2.3.55311 > 5.6.7.8.80: Flags [S], seq 231350316, win 29200, options [mss 1460,sackOK,TS val 4136573 ecr 0,nop,wscale 7], length 0
14:48:14.471320 IP 5.6.7.8.80 > 1.1.2.3.55311: Flags [S.], seq 4027918797, ack 231350317, win 28960, options [mss 1460,sackOK,TS val 4136107 ecr 4136573,nop,wscale 7], length 0
14:48:14.471378 IP 1.1.2.3.55311 > 5.6.7.8.80: Flags [.], ack 1, win 229, options [nop,nop,TS val 4136574 ecr 4136107], length 0
14:48:14.471476 IP 1.1.2.3.55311 > 5.6.7.8.80: Flags [P.], seq 1:115, ack 1, win 229, options [nop,nop,TS val 4136574 ecr 4136107], length 114
14:48:14.471716 IP 5.6.7.8.80 > 1.1.2.3.55311: Flags [.], ack 115, win 227, options [nop,nop,TS val 4136107 ecr 4136574], length 0
14:48:14.472614 IP 5.6.7.8.80 > 1.1.2.3.55311: Flags [.], seq 1:1449, ack 115, win 227, options [nop,nop,TS val 4136107 ecr 4136574], length 1448
14:48:14.472626 IP 1.1.2.3.55311 > 5.6.7.8.80: Flags [.], ack 1449, win 251, options [nop,nop,TS val 4136574 ecr 4136107], length 0
14:48:14.472683 IP 5.6.7.8.80 > 1.1.2.3.55311: Flags [.], seq 1449:8689, ack 115, win 227, options [nop,nop,TS val 4136107 ecr 4136574], length 7240
14:48:14.472708 IP 1.1.2.3.55311 > 5.6.7.8.80: Flags [.], ack 8689, win 364, options [nop,nop,TS val 4136574 ecr 4136107], length 0
14:48:14.472773 IP 5.6.7.8.80 > 1.1.2.3.55311: Flags [P.], seq 8689:11821, ack 115, win 227, options [nop,nop,TS val 4136107 ecr 4136574], length 3132
14:48:14.472790 IP 1.1.2.3.55311 > 5.6.7.8.80: Flags [.], ack 11821, win 413, options [nop,nop,TS val 4136574 ecr 4136107], length 0
14:48:14.477974 IP 1.1.2.3.55311 > 5.6.7.8.80: Flags [F.], seq 115, ack 11821, win 413, options [nop,nop,TS val 4136575 ecr 4136107], length 0
14:48:14.478457 IP 5.6.7.8.80 > 1.1.2.3.55311: Flags [F.], seq 11821, ack 116, win 227, options [nop,nop,TS val 4136109 ecr 4136575], length 0
14:48:14.478489 IP 1.1.2.3.55311 > 5.6.7.8.80: Flags [.], ack 11822, win 413, options [nop,nop,TS val 4136575 ecr 4136109], length 0
14:48:15.489728 IP 1.1.2.3.55312 > 5.6.7.8.80: Flags [S], seq 2334149762, win 29200, options [mss 1460,sackOK,TS val 4136828 ecr 0,nop,wscale 7], length 0
14:48:15.489946 IP 5.6.7.8.80 > 1.1.2.3.55312: Flags [S.], seq 2458018612, ack 2334149763, win 28960, options [mss 1460,sackOK,TS val 4136362 ecr 4136828,nop,wscale 7], length 0
14:48:15.489979 IP 1.1.2.3.55312 > 5.6.7.8.80: Flags [.], ack 1, win 229, options [nop,nop,TS val 4136828 ecr 4136362], length 0
14:48:15.490068 IP 1.1.2.3.55312 > 5.6.7.8.80: Flags [P.], seq 1:115, ack 1, win 229, options [nop,nop,TS val 4136828 ecr 4136362], length 114
14:48:15.490246 IP 5.6.7.8.80 > 1.1.2.3.55312: Flags [.], ack 115, win 227, options [nop,nop,TS val 4136362 ecr 4136828], length 0
14:48:15.490600 IP 5.6.7.8.80 > 1.1.2.3.55312: Flags [.], seq 1:4345, ack 115, win 227, options [nop,nop,TS val 4136362 ecr 4136828], length 4344
14:48:15.490620 IP 1.1.2.3.55312 > 5.6.7.8.80: Flags [.], ack 4345, win 296, options [nop,nop,TS val 4136828 ecr 4136362], length 0
14:48:15.490655 IP 5.6.7.8.80 > 1.1.2.3.55312: Flags [.], seq 4345:8689, ack 115, win 227, options [nop,nop,TS val 4136362 ecr 4136828], length 4344
14:48:15.490669 IP 1.1.2.3.55312 > 5.6.7.8.80: Flags [.], ack 8689, win 364, options [nop,nop,TS val 4136828 ecr 4136362], length 0
14:48:15.490709 IP 5.6.7.8.80 > 1.1.2.3.55312: Flags [P.], seq 8689:11821, ack 115, win 227, options [nop,nop,TS val 4136362 ecr 4136828], length 3132
14:48:15.490727 IP 1.1.2.3.55312 > 5.6.7.8.80: Flags [.], ack 11821, win 413, options [nop,nop,TS val 4136828 ecr 4136362], length 0
14:48:15.496333 IP 1.1.2.3.55312 > 5.6.7.8.80: Flags [F.], seq 115, ack 11821, win 413, options [nop,nop,TS val 4136830 ecr 4136362], length 0
14:48:15.496685 IP 5.6.7.8.80 > 1.1.2.3.55312: Flags [F.], seq 11821, ack 116, win 227, options [nop,nop,TS val 4136363 ecr 4136830], length 0
14:48:15.496718 IP 1.1.2.3.55312 > 5.6.7.8.80: Flags [.], ack 11822, win 413, options [nop,nop,TS val 4136830 ecr 4136363], length 0
14:48:16.507905 IP 1.1.2.3.55313 > 5.6.7.8.80: Flags [S], seq 60583956, win 29200, options [mss 1460,sackOK,TS val 4137083 ecr 0,nop,wscale 7], length 0
14:48:16.508076 IP 5.6.7.8.80 > 1.1.2.3.55313: Flags [S.], seq 688580454, ack 60583957, win 28960, options [mss 1460,sackOK,TS val 4136616 ecr 4137083,nop,wscale 7], length 0
14:48:16.508108 IP 1.1.2.3.55313 > 5.6.7.8.80: Flags [.], ack 1, win 229, options [nop,nop,TS val 4137083 ecr 4136616], length 0
14:48:16.508195 IP 1.1.2.3.55313 > 5.6.7.8.80: Flags [P.], seq 1:115, ack 1, win 229, options [nop,nop,TS val 4137083 ecr 4136616], length 114
14:48:16.508375 IP 5.6.7.8.80 > 1.1.2.3.55313: Flags [.], ack 115, win 227, options [nop,nop,TS val 4136616 ecr 4137083], length 0
14:48:16.508624 IP 5.6.7.8.80 > 1.1.2.3.55313: Flags [.], seq 1:1449, ack 115, win 227, options [nop,nop,TS val 4136616 ecr 4137083], length 1448
14:48:16.508634 IP 1.1.2.3.55313 > 5.6.7.8.80: Flags [.], ack 1449, win 251, options [nop,nop,TS val 4137083 ecr 4136616], length 0
14:48:16.508685 IP 5.6.7.8.80 > 1.1.2.3.55313: Flags [.], seq 1449:5793, ack 115, win 227, options [nop,nop,TS val 4136616 ecr 4137083], length 4344
14:48:16.508707 IP 1.1.2.3.55313 > 5.6.7.8.80: Flags [.], ack 5793, win 319, options [nop,nop,TS val 4137083 ecr 4136616], length 0
14:48:16.508737 IP 5.6.7.8.80 > 1.1.2.3.55313: Flags [P.], seq 5793:11821, ack 115, win 227, options [nop,nop,TS val 4136616 ecr 4137083], length 6028
14:48:16.508753 IP 1.1.2.3.55313 > 5.6.7.8.80: Flags [.], ack 11821, win 413, options [nop,nop,TS val 4137083 ecr 4136616], length 0
14:48:16.514186 IP 1.1.2.3.55313 > 5.6.7.8.80: Flags [F.], seq 115, ack 11821, win 413, options [nop,nop,TS val 4137084 ecr 4136616], length 0
14:48:16.514766 IP 5.6.7.8.80 > 1.1.2.3.55313: Flags [F.], seq 11821, ack 116, win 227, options [nop,nop,TS val 4136618 ecr 4137084], length 0
14:48:16.514788 IP 1.1.2.3.55313 > 5.6.7.8.80: Flags [.], ack 11822, win 413, options [nop,nop,TS val 4137084 ecr 4136618], length 0
14:48:17.526880 IP 1.1.2.3.55314 > 5.6.7.8.80: Flags [S], seq 955048319, win 29200, options [mss 1460,sackOK,TS val 4137337 ecr 0,nop,wscale 7], length 0
14:48:17.527100 IP 5.6.7.8.80 > 1.1.2.3.55314: Flags [S.], seq 1810696421, ack 955048320, win 28960, options [mss 1460,sackOK,TS val 4136871 ecr 4137337,nop,wscale 7], length 0
14:48:17.527126 IP 1.1.2.3.55314 > 5.6.7.8.80: Flags [.], ack 1, win 229, options [nop,nop,TS val 4137337 ecr 4136871], length 0
14:48:17.527208 IP 1.1.2.3.55314 > 5.6.7.8.80: Flags [P.], seq 1:115, ack 1, win 229, options [nop,nop,TS val 4137337 ecr 4136871], length 114
14:48:17.527401 IP 5.6.7.8.80 > 1.1.2.3.55314: Flags [.], ack 115, win 227, options [nop,nop,TS val 4136871 ecr 4137337], length 0
14:48:17.527702 IP 5.6.7.8.80 > 1.1.2.3.55314: Flags [.], seq 1:2897, ack 115, win 227, options [nop,nop,TS val 4136871 ecr 4137337], length 2896
14:48:17.527714 IP 1.1.2.3.55314 > 5.6.7.8.80: Flags [.], ack 2897, win 274, options [nop,nop,TS val 4137338 ecr 4136871], length 0
14:48:17.527763 IP 5.6.7.8.80 > 1.1.2.3.55314: Flags [.], seq 2897:10137, ack 115, win 227, options [nop,nop,TS val 4136871 ecr 4137337], length 7240
14:48:17.527787 IP 1.1.2.3.55314 > 5.6.7.8.80: Flags [.], ack 10137, win 387, options [nop,nop,TS val 4137338 ecr 4136871], length 0
14:48:17.527854 IP 5.6.7.8.80 > 1.1.2.3.55314: Flags [P.], seq 10137:11821, ack 115, win 227, options [nop,nop,TS val 4136871 ecr 4137337], length 1684
14:48:17.527870 IP 1.1.2.3.55314 > 5.6.7.8.80: Flags [.], ack 11821, win 413, options [nop,nop,TS val 4137338 ecr 4136871], length 0
14:48:17.533255 IP 1.1.2.3.55314 > 5.6.7.8.80: Flags [F.], seq 115, ack 11821, win 413, options [nop,nop,TS val 4137339 ecr 4136871], length 0
14:48:17.533791 IP 5.6.7.8.80 > 1.1.2.3.55314: Flags [F.], seq 11821, ack 116, win 227, options [nop,nop,TS val 4136873 ecr 4137339], length 0
14:48:17.533808 IP 1.1.2.3.55314 > 5.6.7.8.80: Flags [.], ack 11822, win 413, options [nop,nop,TS val 4137339 ecr 4136873], length 0
14:48:18.545914 IP 1.1.2.3.55315 > 5.6.7.8.80: Flags [S], seq 2810225232, win 29200, options [mss 1460,sackOK,TS val 4137592 ecr 0,nop,wscale 7], length 0
14:48:18.546229 IP 5.6.7.8.80 > 1.1.2.3.55315: Flags [S.], seq 2427352189, ack 2810225233, win 28960, options [mss 1460,sackOK,TS val 4137126 ecr 4137592,nop,wscale 7], length 0
14:48:18.546257 IP 1.1.2.3.55315 > 5.6.7.8.80: Flags [.], ack 1, win 229, options [nop,nop,TS val 4137592 ecr 4137126], length 0
14:48:18.546340 IP 1.1.2.3.55315 > 5.6.7.8.80: Flags [P.], seq 1:115, ack 1, win 229, options [nop,nop,TS val 4137592 ecr 4137126], length 114
14:48:18.546529 IP 5.6.7.8.80 > 1.1.2.3.55315: Flags [.], ack 115, win 227, options [nop,nop,TS val 4137126 ecr 4137592], length 0
14:48:18.546832 IP 5.6.7.8.80 > 1.1.2.3.55315: Flags [.], seq 1:2897, ack 115, win 227, options [nop,nop,TS val 4137126 ecr 4137592], length 2896
14:48:18.546843 IP 1.1.2.3.55315 > 5.6.7.8.80: Flags [.], ack 2897, win 274, options [nop,nop,TS val 4137592 ecr 4137126], length 0
14:48:18.546893 IP 5.6.7.8.80 > 1.1.2.3.55315: Flags [.], seq 2897:7241, ack 115, win 227, options [nop,nop,TS val 4137126 ecr 4137592], length 4344
14:48:18.546915 IP 1.1.2.3.55315 > 5.6.7.8.80: Flags [.], ack 7241, win 342, options [nop,nop,TS val 4137592 ecr 4137126], length 0
14:48:18.546987 IP 5.6.7.8.80 > 1.1.2.3.55315: Flags [P.], seq 7241:11821, ack 115, win 227, options [nop,nop,TS val 4137126 ecr 4137592], length 4580
14:48:18.547007 IP 1.1.2.3.55315 > 5.6.7.8.80: Flags [.], ack 11821, win 413, options [nop,nop,TS val 4137592 ecr 4137126], length 0
14:48:18.552336 IP 1.1.2.3.55315 > 5.6.7.8.80: Flags [F.], seq 115, ack 11821, win 413, options [nop,nop,TS val 4137594 ecr 4137126], length 0
14:48:18.552719 IP 5.6.7.8.80 > 1.1.2.3.55315: Flags [F.], seq 11821, ack 116, win 227, options [nop,nop,TS val 4137127 ecr 4137594], length 0
14:48:18.552743 IP 1.1.2.3.55315 > 5.6.7.8.80: Flags [.], ack 11822, win 413, options [nop,nop,TS val 4137594 ecr 4137127], length 0
14:48:19.565608 IP 1.1.2.3.55316 > 5.6.7.8.80: Flags [S], seq 1780466342, win 29200, options [mss 1460,sackOK,TS val 4137847 ecr 0,nop,wscale 7], length 0
14:48:19.565862 IP 5.6.7.8.80 > 1.1.2.3.55316: Flags [S.], seq 246764921, ack 1780466343, win 28960, options [mss 1460,sackOK,TS val 4137381 ecr 4137847,nop,wscale 7], length 0
14:48:19.565888 IP 1.1.2.3.55316 > 5.6.7.8.80: Flags [.], ack 1, win 229, options [nop,nop,TS val 4137847 ecr 4137381], length 0
14:48:19.566011 IP 1.1.2.3.55316 > 5.6.7.8.80: Flags [P.], seq 1:115, ack 1, win 229, options [nop,nop,TS val 4137847 ecr 4137381], length 114
14:48:19.566213 IP 5.6.7.8.80 > 1.1.2.3.55316: Flags [.], ack 115, win 227, options [nop,nop,TS val 4137381 ecr 4137847], length 0
14:48:19.566516 IP 5.6.7.8.80 > 1.1.2.3.55316: Flags [.], seq 1:5793, ack 115, win 227, options [nop,nop,TS val 4137381 ecr 4137847], length 5792
14:48:19.566535 IP 1.1.2.3.55316 > 5.6.7.8.80: Flags [.], ack 5793, win 319, options [nop,nop,TS val 4137847 ecr 4137381], length 0
14:48:19.566570 IP 5.6.7.8.80 > 1.1.2.3.55316: Flags [P.], seq 5793:11821, ack 115, win 227, options [nop,nop,TS val 4137381 ecr 4137847], length 6028
14:48:19.566588 IP 1.1.2.3.55316 > 5.6.7.8.80: Flags [.], ack 11821, win 413, options [nop,nop,TS val 4137847 ecr 4137381], length 0
14:48:19.572383 IP 1.1.2.3.55316 > 5.6.7.8.80: Flags [F.], seq 115, ack 11821, win 413, options [nop,nop,TS val 4137849 ecr 4137381], length 0
14:48:19.572901 IP 5.6.7.8.80 > 1.1.2.3.55316: Flags [F.], seq 11821, ack 116, win 227, options [nop,nop,TS val 4137382 ecr 4137849], length 0
14:48:19.572919 IP 1.1.2.3.55316 > 5.6.7.8.80: Flags [.], ack 11822, win 413, options [nop,nop,TS val 4137849 ecr 4137382], length 0
14:48:21.382209 IP 1.1.2.3.55317 > 5.6.7.8.80: Flags [S], seq 1625321225, win 29200, options [mss 1460,sackOK,TS val 4138301 ecr 0,nop,wscale 7], length 0
14:48:21.382430 IP 5.6.7.8.80 > 1.1.2.3.55317: Flags [S.], seq 635406324, ack 1625321226, win 28960, options [mss 1460,sackOK,TS val 4137835 ecr 4138301,nop,wscale 7], length 0
14:48:21.382462 IP 1.1.2.3.55317 > 5.6.7.8.80: Flags [.], ack 1, win 229, options [nop,nop,TS val 4138301 ecr 4137835], length 0
14:48:21.382565 IP 1.1.2.3.55317 > 5.6.7.8.80: Flags [P.], seq 1:115, ack 1, win 229, options [nop,nop,TS val 4138301 ecr 4137835], length 114
14:48:21.382729 IP 5.6.7.8.80 > 1.1.2.3.55317: Flags [.], ack 115, win 227, options [nop,nop,TS val 4137835 ecr 4138301], length 0
14:48:21.383082 IP 5.6.7.8.80 > 1.1.2.3.55317: Flags [.], seq 1:2897, ack 115, win 227, options [nop,nop,TS val 4137835 ecr 4138301], length 2896
14:48:21.383094 IP 1.1.2.3.55317 > 5.6.7.8.80: Flags [.], ack 2897, win 274, options [nop,nop,TS val 4138301 ecr 4137835], length 0
14:48:21.383144 IP 5.6.7.8.80 > 1.1.2.3.55317: Flags [.], seq 2897:10137, ack 115, win 227, options [nop,nop,TS val 4137835 ecr 4138301], length 7240
14:48:21.383169 IP 1.1.2.3.55317 > 5.6.7.8.80: Flags [.], ack 10137, win 387, options [nop,nop,TS val 4138301 ecr 4137835], length 0
14:48:21.383235 IP 5.6.7.8.80 > 1.1.2.3.55317: Flags [P.], seq 10137:11821, ack 115, win 227, options [nop,nop,TS val 4137835 ecr 4138301], length 1684
14:48:21.383254 IP 1.1.2.3.55317 > 5.6.7.8.80: Flags [.], ack 11821, win 413, options [nop,nop,TS val 4138301 ecr 4137835], length 0
14:48:21.388879 IP 1.1.2.3.55317 > 5.6.7.8.80: Flags [F.], seq 115, ack 11821, win 413, options [nop,nop,TS val 4138303 ecr 4137835], length 0
14:48:21.389170 IP 5.6.7.8.80 > 1.1.2.3.55317: Flags [F.], seq 11821, ack 116, win 227, options [nop,nop,TS val 4137836 ecr 4138303], length 0
14:48:21.389199 IP 1.1.2.3.55317 > 5.6.7.8.80: Flags [.], ack 11822, win 413, options [nop,nop,TS val 4138303 ecr 4137836], length 0
14:48:22.402005 IP 1.1.2.3.55318 > 5.6.7.8.80: Flags [S], seq 2600678013, win 29200, options [mss 1460,sackOK,TS val 4138556 ecr 0,nop,wscale 7], length 0
14:48:22.402306 IP 5.6.7.8.80 > 1.1.2.3.55318: Flags [S.], seq 4008857263, ack 2600678014, win 28960, options [mss 1460,sackOK,TS val 4138090 ecr 4138556,nop,wscale 7], length 0
14:48:22.402339 IP 1.1.2.3.55318 > 5.6.7.8.80: Flags [.], ack 1, win 229, options [nop,nop,TS val 4138556 ecr 4138090], length 0
14:48:22.402472 IP 1.1.2.3.55318 > 5.6.7.8.80: Flags [P.], seq 1:115, ack 1, win 229, options [nop,nop,TS val 4138556 ecr 4138090], length 114
14:48:22.402655 IP 5.6.7.8.80 > 1.1.2.3.55318: Flags [.], ack 115, win 227, options [nop,nop,TS val 4138090 ecr 4138556], length 0
14:48:22.402904 IP 5.6.7.8.80 > 1.1.2.3.55318: Flags [.], seq 1:1449, ack 115, win 227, options [nop,nop,TS val 4138090 ecr 4138556], length 1448
14:48:22.402915 IP 1.1.2.3.55318 > 5.6.7.8.80: Flags [.], ack 1449, win 251, options [nop,nop,TS val 4138556 ecr 4138090], length 0
14:48:22.402962 IP 5.6.7.8.80 > 1.1.2.3.55318: Flags [.], seq 1449:4345, ack 115, win 227, options [nop,nop,TS val 4138090 ecr 4138556], length 2896
14:48:22.402980 IP 1.1.2.3.55318 > 5.6.7.8.80: Flags [.], ack 4345, win 296, options [nop,nop,TS val 4138556 ecr 4138090], length 0
14:48:22.403017 IP 5.6.7.8.80 > 1.1.2.3.55318: Flags [P.], seq 4345:11821, ack 115, win 227, options [nop,nop,TS val 4138090 ecr 4138556], length 7476
14:48:22.403035 IP 1.1.2.3.55318 > 5.6.7.8.80: Flags [.], ack 11821, win 413, options [nop,nop,TS val 4138556 ecr 4138090], length 0
14:48:22.408527 IP 1.1.2.3.55318 > 5.6.7.8.80: Flags [F.], seq 115, ack 11821, win 413, options [nop,nop,TS val 4138558 ecr 4138090], length 0
14:48:22.409046 IP 5.6.7.8.80 > 1.1.2.3.55318: Flags [F.], seq 11821, ack 116, win 227, options [nop,nop,TS val 4138091 ecr 4138558], length 0
14:48:22.409065 IP 1.1.2.3.55318 > 5.6.7.8.80: Flags [.], ack 11822, win 413, options [nop,nop,TS val 4138558 ecr 4138091], length 0
14:48:23.421582 IP 1.1.2.3.55319 > 5.6.7.8.80: Flags [S], seq 802652089, win 29200, options [mss 1460,sackOK,TS val 4138811 ecr 0,nop,wscale 7], length 0
14:48:23.421786 IP 5.6.7.8.80 > 1.1.2.3.55319: Flags [S.], seq 3055385944, ack 802652090, win 28960, options [mss 1460,sackOK,TS val 4138345 ecr 4138811,nop,wscale 7], length 0
14:48:23.421815 IP 1.1.2.3.55319 > 5.6.7.8.80: Flags [.], ack 1, win 229, options [nop,nop,TS val 4138811 ecr 4138345], length 0
14:48:23.421937 IP 1.1.2.3.55319 > 5.6.7.8.80: Flags [P.], seq 1:115, ack 1, win 229, options [nop,nop,TS val 4138811 ecr 4138345], length 114
14:48:23.422185 IP 5.6.7.8.80 > 1.1.2.3.55319: Flags [.], ack 115, win 227, options [nop,nop,TS val 4138345 ecr 4138811], length 0
14:48:23.422434 IP 5.6.7.8.80 > 1.1.2.3.55319: Flags [.], seq 1:1449, ack 115, win 227, options [nop,nop,TS val 4138345 ecr 4138811], length 1448
14:48:23.422444 IP 1.1.2.3.55319 > 5.6.7.8.80: Flags [.], ack 1449, win 251, options [nop,nop,TS val 4138811 ecr 4138345], length 0
14:48:23.422499 IP 5.6.7.8.80 > 1.1.2.3.55319: Flags [.], seq 1449:7241, ack 115, win 227, options [nop,nop,TS val 4138345 ecr 4138811], length 5792
14:48:23.422521 IP 1.1.2.3.55319 > 5.6.7.8.80: Flags [.], ack 7241, win 342, options [nop,nop,TS val 4138811 ecr 4138345], length 0
14:48:23.422592 IP 5.6.7.8.80 > 1.1.2.3.55319: Flags [P.], seq 7241:11821, ack 115, win 227, options [nop,nop,TS val 4138345 ecr 4138811], length 4580
14:48:23.422616 IP 1.1.2.3.55319 > 5.6.7.8.80: Flags [.], ack 11821, win 413, options [nop,nop,TS val 4138811 ecr 4138345], length 0
14:48:23.428100 IP 1.1.2.3.55319 > 5.6.7.8.80: Flags [F.], seq 115, ack 11821, win 413, options [nop,nop,TS val 4138813 ecr 4138345], length 0
14:48:23.428575 IP 5.6.7.8.80 > 1.1.2.3.55319: Flags [F.], seq 11821, ack 116, win 227, options [nop,nop,TS val 4138346 ecr 4138813], length 0
14:48:23.428593 IP 1.1.2.3.55319 > 5.6.7.8.80: Flags [.], ack 11822, win 413, options [nop,nop,TS val 4138813 ecr 4138346], length 0
14:48:24.442254 IP 1.1.2.3.55320 > 5.6.7.8.80: Flags [S], seq 2939689098, win 29200, options [mss 1460,sackOK,TS val 4139066 ecr 0,nop,wscale 7], length 0
14:48:24.442562 IP 5.6.7.8.80 > 1.1.2.3.55320: Flags [S.], seq 1074240741, ack 2939689099, win 28960, options [mss 1460,sackOK,TS val 4138600 ecr 4139066,nop,wscale 7], length 0
14:48:24.442589 IP 1.1.2.3.55320 > 5.6.7.8.80: Flags [.], ack 1, win 229, options [nop,nop,TS val 4139066 ecr 4138600], length 0
14:48:24.442712 IP 1.1.2.3.55320 > 5.6.7.8.80: Flags [P.], seq 1:115, ack 1, win 229, options [nop,nop,TS val 4139066 ecr 4138600], length 114
14:48:24.442861 IP 5.6.7.8.80 > 1.1.2.3.55320: Flags [.], ack 115, win 227, options [nop,nop,TS val 4138600 ecr 4139066], length 0
14:48:24.443163 IP 5.6.7.8.80 > 1.1.2.3.55320: Flags [.], seq 1:2897, ack 115, win 227, options [nop,nop,TS val 4138600 ecr 4139066], length 2896
14:48:24.443174 IP 1.1.2.3.55320 > 5.6.7.8.80: Flags [.], ack 2897, win 274, options [nop,nop,TS val 4139066 ecr 4138600], length 0
14:48:24.443221 IP 5.6.7.8.80 > 1.1.2.3.55320: Flags [.], seq 2897:5793, ack 115, win 227, options [nop,nop,TS val 4138600 ecr 4139066], length 2896
14:48:24.443240 IP 1.1.2.3.55320 > 5.6.7.8.80: Flags [.], ack 5793, win 319, options [nop,nop,TS val 4139066 ecr 4138600], length 0
14:48:24.443273 IP 5.6.7.8.80 > 1.1.2.3.55320: Flags [P.], seq 5793:11821, ack 115, win 227, options [nop,nop,TS val 4138600 ecr 4139066], length 6028
14:48:24.443289 IP 1.1.2.3.55320 > 5.6.7.8.80: Flags [.], ack 11821, win 413, options [nop,nop,TS val 4139066 ecr 4138600], length 0
14:48:24.449267 IP 1.1.2.3.55320 > 5.6.7.8.80: Flags [F.], seq 115, ack 11821, win 413, options [nop,nop,TS val 4139068 ecr 4138600], length 0
14:48:24.449801 IP 5.6.7.8.80 > 1.1.2.3.55320: Flags [F.], seq 11821, ack 116, win 227, options [nop,nop,TS val 4138602 ecr 4139068], length 0
14:48:24.449820 IP 1.1.2.3.55320 > 5.6.7.8.80: Flags [.], ack 11822, win 413, options [nop,nop,TS val 4139068 ecr 4138602], length 0
14:48:25.463620 IP 1.1.2.3.55321 > 5.6.7.8.80: Flags [S], seq 117299656, win 29200, options [mss 1460,sackOK,TS val 4139322 ecr 0,nop,wscale 7], length 0
14:48:25.463837 IP 5.6.7.8.80 > 1.1.2.3.55321: Flags [S.], seq 1779517755, ack 117299657, win 28960, options [mss 1460,sackOK,TS val 4138855 ecr 4139322,nop,wscale 7], length 0
14:48:25.463866 IP 1.1.2.3.55321 > 5.6.7.8.80: Flags [.], ack 1, win 229, options [nop,nop,TS val 4139322 ecr 4138855], length 0
14:48:25.463989 IP 1.1.2.3.55321 > 5.6.7.8.80: Flags [P.], seq 1:115, ack 1, win 229, options [nop,nop,TS val 4139322 ecr 4138855], length 114
14:48:25.464187 IP 5.6.7.8.80 > 1.1.2.3.55321: Flags [.], ack 115, win 227, options [nop,nop,TS val 4138855 ecr 4139322], length 0
14:48:25.464542 IP 5.6.7.8.80 > 1.1.2.3.55321: Flags [.], seq 1:7241, ack 115, win 227, options [nop,nop,TS val 4138855 ecr 4139322], length 7240
14:48:25.464564 IP 1.1.2.3.55321 > 5.6.7.8.80: Flags [.], ack 7241, win 342, options [nop,nop,TS val 4139322 ecr 4138855], length 0
14:48:25.464594 IP 5.6.7.8.80 > 1.1.2.3.55321: Flags [P.], seq 7241:11821, ack 115, win 227, options [nop,nop,TS val 4138855 ecr 4139322], length 4580
14:48:25.464611 IP 1.1.2.3.55321 > 5.6.7.8.80: Flags [.], ack 11821, win 413, options [nop,nop,TS val 4139322 ecr 4138855], length 0
14:48:25.470183 IP 1.1.2.3.55321 > 5.6.7.8.80: Flags [F.], seq 115, ack 11821, win 413, options [nop,nop,TS val 4139323 ecr 4138855], length 0
14:48:25.470576 IP 5.6.7.8.80 > 1.1.2.3.55321: Flags [F.], seq 11821, ack 116, win 227, options [nop,nop,TS val 4138857 ecr 4139323], length 0
14:48:25.470601 IP 1.1.2.3.55321 > 5.6.7.8.80: Flags [.], ack 11822, win 413, options [nop,nop,TS val 4139323 ecr 4138857], length 0
14:48:26.485407 IP 1.1.2.3.55322 > 5.6.7.8.80: Flags [S], seq 3527324860, win 29200, options [mss 1460,sackOK,TS val 4139577 ecr 0,nop,wscale 7], length 0
14:48:26.485612 IP 5.6.7.8.80 > 1.1.2.3.55322: Flags [S.], seq 2398878738, ack 3527324861, win 28960, options [mss 1460,sackOK,TS val 4139110 ecr 4139577,nop,wscale 7], length 0
14:48:26.485641 IP 1.1.2.3.55322 > 5.6.7.8.80: Flags [.], ack 1, win 229, options [nop,nop,TS val 4139577 ecr 4139110], length 0
14:48:26.485766 IP 1.1.2.3.55322 > 5.6.7.8.80: Flags [P.], seq 1:115, ack 1, win 229, options [nop,nop,TS val 4139577 ecr 4139110], length 114
14:48:26.486008 IP 5.6.7.8.80 > 1.1.2.3.55322: Flags [.], ack 115, win 227, options [nop,nop,TS val 4139111 ecr 4139577], length 0
14:48:26.486311 IP 5.6.7.8.80 > 1.1.2.3.55322: Flags [.], seq 1:4345, ack 115, win 227, options [nop,nop,TS val 4139111 ecr 4139577], length 4344
14:48:26.486330 IP 1.1.2.3.55322 > 5.6.7.8.80: Flags [.], ack 4345, win 296, options [nop,nop,TS val 4139577 ecr 4139111], length 0
14:48:26.486375 IP 5.6.7.8.80 > 1.1.2.3.55322: Flags [P.], seq 4345:11821, ack 115, win 227, options [nop,nop,TS val 4139111 ecr 4139577], length 7476
14:48:26.486400 IP 1.1.2.3.55322 > 5.6.7.8.80: Flags [.], ack 11821, win 413, options [nop,nop,TS val 4139577 ecr 4139111], length 0
14:48:26.491849 IP 1.1.2.3.55322 > 5.6.7.8.80: Flags [F.], seq 115, ack 11821, win 413, options [nop,nop,TS val 4139579 ecr 4139111], length 0
14:48:26.492399 IP 5.6.7.8.80 > 1.1.2.3.55322: Flags [F.], seq 11821, ack 116, win 227, options [nop,nop,TS val 4139112 ecr 4139579], length 0
14:48:26.492419 IP 1.1.2.3.55322 > 5.6.7.8.80: Flags [.], ack 11822, win 413, options [nop,nop,TS val 4139579 ecr 4139112], length 0
14:48:27.505777 IP 1.1.2.3.55323 > 5.6.7.8.80: Flags [S], seq 1684542193, win 29200, options [mss 1460,sackOK,TS val 4139832 ecr 0,nop,wscale 7], length 0
14:48:27.506039 IP 5.6.7.8.80 > 1.1.2.3.55323: Flags [S.], seq 3944333458, ack 1684542194, win 28960, options [mss 1460,sackOK,TS val 4139366 ecr 4139832,nop,wscale 7], length 0
14:48:27.506067 IP 1.1.2.3.55323 > 5.6.7.8.80: Flags [.], ack 1, win 229, options [nop,nop,TS val 4139832 ecr 4139366], length 0
14:48:27.506187 IP 1.1.2.3.55323 > 5.6.7.8.80: Flags [P.], seq 1:115, ack 1, win 229, options [nop,nop,TS val 4139832 ecr 4139366], length 114
14:48:27.506389 IP 5.6.7.8.80 > 1.1.2.3.55323: Flags [.], ack 115, win 227, options [nop,nop,TS val 4139366 ecr 4139832], length 0
14:48:27.506641 IP 5.6.7.8.80 > 1.1.2.3.55323: Flags [.], seq 1:2897, ack 115, win 227, options [nop,nop,TS val 4139366 ecr 4139832], length 2896
14:48:27.506653 IP 1.1.2.3.55323 > 5.6.7.8.80: Flags [.], ack 2897, win 274, options [nop,nop,TS val 4139832 ecr 4139366], length 0
14:48:27.506698 IP 5.6.7.8.80 > 1.1.2.3.55323: Flags [.], seq 2897:8689, ack 115, win 227, options [nop,nop,TS val 4139366 ecr 4139832], length 5792
14:48:27.506719 IP 1.1.2.3.55323 > 5.6.7.8.80: Flags [.], ack 8689, win 364, options [nop,nop,TS val 4139832 ecr 4139366], length 0
14:48:27.506749 IP 5.6.7.8.80 > 1.1.2.3.55323: Flags [P.], seq 8689:11821, ack 115, win 227, options [nop,nop,TS val 4139366 ecr 4139832], length 3132
14:48:27.506760 IP 1.1.2.3.55323 > 5.6.7.8.80: Flags [.], ack 11821, win 413, options [nop,nop,TS val 4139832 ecr 4139366], length 0
14:48:27.512448 IP 1.1.2.3.55323 > 5.6.7.8.80: Flags [F.], seq 115, ack 11821, win 413, options [nop,nop,TS val 4139834 ecr 4139366], length 0
14:48:27.513027 IP 5.6.7.8.80 > 1.1.2.3.55323: Flags [F.], seq 11821, ack 116, win 227, options [nop,nop,TS val 4139367 ecr 4139834], length 0
14:48:27.513049 IP 1.1.2.3.55323 > 5.6.7.8.80: Flags [.], ack 11822, win 413, options [nop,nop,TS val 4139834 ecr 4139367], length 0
14:48:28.526814 IP 1.1.2.3.55324 > 5.6.7.8.80: Flags [S], seq 574881207, win 29200, options [mss 1460,sackOK,TS val 4140087 ecr 0,nop,wscale 7], length 0
14:48:28.527063 IP 5.6.7.8.80 > 1.1.2.3.55324: Flags [S.], seq 1553945831, ack 574881208, win 28960, options [mss 1460,sackOK,TS val 4139621 ecr 4140087,nop,wscale 7], length 0
14:48:28.527095 IP 1.1.2.3.55324 > 5.6.7.8.80: Flags [.], ack 1, win 229, options [nop,nop,TS val 4140087 ecr 4139621], length 0
14:48:28.527225 IP 1.1.2.3.55324 > 5.6.7.8.80: Flags [P.], seq 1:115, ack 1, win 229, options [nop,nop,TS val 4140087 ecr 4139621], length 114
14:48:28.527413 IP 5.6.7.8.80 > 1.1.2.3.55324: Flags [.], ack 115, win 227, options [nop,nop,TS val 4139621 ecr 4140087], length 0
14:48:28.527717 IP 5.6.7.8.80 > 1.1.2.3.55324: Flags [.], seq 1:4345, ack 115, win 227, options [nop,nop,TS val 4139621 ecr 4140087], length 4344
14:48:28.527735 IP 1.1.2.3.55324 > 5.6.7.8.80: Flags [.], ack 4345, win 296, options [nop,nop,TS val 4140088 ecr 4139621], length 0
14:48:28.527772 IP 5.6.7.8.80 > 1.1.2.3.55324: Flags [.], seq 4345:10137, ack 115, win 227, options [nop,nop,TS val 4139621 ecr 4140087], length 5792
14:48:28.527790 IP 1.1.2.3.55324 > 5.6.7.8.80: Flags [.], ack 10137, win 387, options [nop,nop,TS val 4140088 ecr 4139621], length 0
14:48:28.527820 IP 5.6.7.8.80 > 1.1.2.3.55324: Flags [P.], seq 10137:11821, ack 115, win 227, options [nop,nop,TS val 4139621 ecr 4140087], length 1684
14:48:28.527830 IP 1.1.2.3.55324 > 5.6.7.8.80: Flags [.], ack 11821, win 413, options [nop,nop,TS val 4140088 ecr 4139621], length 0
14:48:28.533790 IP 1.1.2.3.55324 > 5.6.7.8.80: Flags [F.], seq 115, ack 11821, win 413, options [nop,nop,TS val 4140089 ecr 4139621], length 0
14:48:28.534302 IP 5.6.7.8.80 > 1.1.2.3.55324: Flags [F.], seq 11821, ack 116, win 227, options [nop,nop,TS val 4139623 ecr 4140089], length 0
14:48:28.534320 IP 1.1.2.3.55324 > 5.6.7.8.80: Flags [.], ack 11822, win 413, options [nop,nop,TS val 4140089 ecr 4139623], length 0
14:48:29.548048 IP 1.1.2.3.55325 > 5.6.7.8.80: Flags [S], seq 1221315698, win 29200, options [mss 1460,sackOK,TS val 4140343 ecr 0,nop,wscale 7], length 0
14:48:29.548286 IP 5.6.7.8.80 > 1.1.2.3.55325: Flags [S.], seq 1995603221, ack 1221315699, win 28960, options [mss 1460,sackOK,TS val 4139876 ecr 4140343,nop,wscale 7], length 0
14:48:29.548314 IP 1.1.2.3.55325 > 5.6.7.8.80: Flags [.], ack 1, win 229, options [nop,nop,TS val 4140343 ecr 4139876], length 0
14:48:29.548436 IP 1.1.2.3.55325 > 5.6.7.8.80: Flags [P.], seq 1:115, ack 1, win 229, options [nop,nop,TS val 4140343 ecr 4139876], length 114
14:48:29.548636 IP 5.6.7.8.80 > 1.1.2.3.55325: Flags [.], ack 115, win 227, options [nop,nop,TS val 4139876 ecr 4140343], length 0
14:48:29.548940 IP 5.6.7.8.80 > 1.1.2.3.55325: Flags [.], seq 1:4345, ack 115, win 227, options [nop,nop,TS val 4139876 ecr 4140343], length 4344
14:48:29.548958 IP 1.1.2.3.55325 > 5.6.7.8.80: Flags [.], ack 4345, win 296, options [nop,nop,TS val 4140343 ecr 4139876], length 0
14:48:29.549002 IP 5.6.7.8.80 > 1.1.2.3.55325: Flags [P.], seq 4345:11821, ack 115, win 227, options [nop,nop,TS val 4139876 ecr 4140343], length 7476
14:48:29.549027 IP 1.1.2.3.55325 > 5.6.7.8.80: Flags [.], ack 11821, win 413, options [nop,nop,TS val 4140343 ecr 4139876], length 0
14:48:29.554520 IP 1.1.2.3.55325 > 5.6.7.8.80: Flags [F.], seq 115, ack 11821, win 413, options [nop,nop,TS val 4140344 ecr 4139876], length 0
14:48:29.555027 IP 5.6.7.8.80 > 1.1.2.3.55325: Flags [F.], seq 11821, ack 116, win 227, options [nop,nop,TS val 4139878 ecr 4140344], length 0
14:48:29.555044 IP 1.1.2.3.55325 > 5.6.7.8.80: Flags [.], ack 11822, win 413, options [nop,nop,TS val 4140344 ecr 4139878], length 0
14:48:30.568596 IP 1.1.2.3.55326 > 5.6.7.8.80: Flags [S], seq 1468743279, win 29200, options [mss 1460,sackOK,TS val 4140598 ecr 0,nop,wscale 7], length 0
14:48:30.568862 IP 5.6.7.8.80 > 1.1.2.3.55326: Flags [S.], seq 2946996883, ack 1468743280, win 28960, options [mss 1460,sackOK,TS val 4140131 ecr 4140598,nop,wscale 7], length 0
14:48:30.568889 IP 1.1.2.3.55326 > 5.6.7.8.80: Flags [.], ack 1, win 229, options [nop,nop,TS val 4140598 ecr 4140131], length 0
14:48:30.569009 IP 1.1.2.3.55326 > 5.6.7.8.80: Flags [P.], seq 1:115, ack 1, win 229, options [nop,nop,TS val 4140598 ecr 4140131], length 114
14:48:30.569262 IP 5.6.7.8.80 > 1.1.2.3.55326: Flags [.], ack 115, win 227, options [nop,nop,TS val 4140131 ecr 4140598], length 0
14:48:30.569514 IP 5.6.7.8.80 > 1.1.2.3.55326: Flags [.], seq 1:2897, ack 115, win 227, options [nop,nop,TS val 4140131 ecr 4140598], length 2896
14:48:30.569526 IP 1.1.2.3.55326 > 5.6.7.8.80: Flags [.], ack 2897, win 274, options [nop,nop,TS val 4140598 ecr 4140131], length 0
14:48:30.569570 IP 5.6.7.8.80 > 1.1.2.3.55326: Flags [.], seq 2897:8689, ack 115, win 227, options [nop,nop,TS val 4140131 ecr 4140598], length 5792
14:48:30.569591 IP 1.1.2.3.55326 > 5.6.7.8.80: Flags [.], ack 8689, win 364, options [nop,nop,TS val 4140598 ecr 4140131], length 0
14:48:30.569623 IP 5.6.7.8.80 > 1.1.2.3.55326: Flags [P.], seq 8689:11821, ack 115, win 227, options [nop,nop,TS val 4140131 ecr 4140598], length 3132
14:48:30.569637 IP 1.1.2.3.55326 > 5.6.7.8.80: Flags [.], ack 11821, win 413, options [nop,nop,TS val 4140598 ecr 4140131], length 0
14:48:30.575184 IP 1.1.2.3.55326 > 5.6.7.8.80: Flags [F.], seq 115, ack 11821, win 413, options [nop,nop,TS val 4140599 ecr 4140131], length 0
14:48:30.575651 IP 5.6.7.8.80 > 1.1.2.3.55326: Flags [F.], seq 11821, ack 116, win 227, options [nop,nop,TS val 4140133 ecr 4140599], length 0
14:48:30.575675 IP 1.1.2.3.55326 > 5.6.7.8.80: Flags [.], ack 11822, win 413, options [nop,nop,TS val 4140600 ecr 4140133], length 0
14:48:31.589600 IP 1.1.2.3.55327 > 5.6.7.8.80: Flags [S], seq 979864167, win 29200, options [mss 1460,sackOK,TS val 4140853 ecr 0,nop,wscale 7], length 0
14:48:31.589844 IP 5.6.7.8.80 > 1.1.2.3.55327: Flags [S.], seq 3924855422, ack 979864168, win 28960, options [mss 1460,sackOK,TS val 4140387 ecr 4140853,nop,wscale 7], length 0
14:48:31.589871 IP 1.1.2.3.55327 > 5.6.7.8.80: Flags [.], ack 1, win 229, options [nop,nop,TS val 4140853 ecr 4140387], length 0
14:48:31.589990 IP 1.1.2.3.55327 > 5.6.7.8.80: Flags [P.], seq 1:115, ack 1, win 229, options [nop,nop,TS val 4140853 ecr 4140387], length 114
14:48:31.590143 IP 5.6.7.8.80 > 1.1.2.3.55327: Flags [.], ack 115, win 227, options [nop,nop,TS val 4140387 ecr 4140853], length 0
14:48:31.590502 IP 5.6.7.8.80 > 1.1.2.3.55327: Flags [.], seq 1:7241, ack 115, win 227, options [nop,nop,TS val 4140387 ecr 4140853], length 7240
14:48:31.590525 IP 1.1.2.3.55327 > 5.6.7.8.80: Flags [.], ack 7241, win 342, options [nop,nop,TS val 4140853 ecr 4140387], length 0
14:48:31.590604 IP 5.6.7.8.80 > 1.1.2.3.55327: Flags [P.], seq 7241:11821, ack 115, win 227, options [nop,nop,TS val 4140387 ecr 4140853], length 4580
14:48:31.590627 IP 1.1.2.3.55327 > 5.6.7.8.80: Flags [.], ack 11821, win 413, options [nop,nop,TS val 4140853 ecr 4140387], length 0
14:48:31.596114 IP 1.1.2.3.55327 > 5.6.7.8.80: Flags [F.], seq 115, ack 11821, win 413, options [nop,nop,TS val 4140855 ecr 4140387], length 0
14:48:31.596582 IP 5.6.7.8.80 > 1.1.2.3.55327: Flags [F.], seq 11821, ack 116, win 227, options [nop,nop,TS val 4140388 ecr 4140855], length 0
14:48:31.596605 IP 1.1.2.3.55327 > 5.6.7.8.80: Flags [.], ack 11822, win 413, options [nop,nop,TS val 4140855 ecr 4140388], length 0
14:48:33.398713 IP 1.1.2.3.55328 > 5.6.7.8.80: Flags [S], seq 2586550208, win 29200, options [mss 1460,sackOK,TS val 4141305 ecr 0,nop,wscale 7], length 0
14:48:33.398922 IP 5.6.7.8.80 > 1.1.2.3.55328: Flags [S.], seq 2451661968, ack 2586550209, win 28960, options [mss 1460,sackOK,TS val 4140839 ecr 4141305,nop,wscale 7], length 0
14:48:33.398949 IP 1.1.2.3.55328 > 5.6.7.8.80: Flags [.], ack 1, win 229, options [nop,nop,TS val 4141305 ecr 4140839], length 0
14:48:33.399068 IP 1.1.2.3.55328 > 5.6.7.8.80: Flags [P.], seq 1:115, ack 1, win 229, options [nop,nop,TS val 4141305 ecr 4140839], length 114
14:48:33.399270 IP 5.6.7.8.80 > 1.1.2.3.55328: Flags [.], ack 115, win 227, options [nop,nop,TS val 4140839 ecr 4141305], length 0
14:48:33.399523 IP 5.6.7.8.80 > 1.1.2.3.55328: Flags [.], seq 1:2897, ack 115, win 227, options [nop,nop,TS val 4140839 ecr 4141305], length 2896
14:48:33.399534 IP 1.1.2.3.55328 > 5.6.7.8.80: Flags [.], ack 2897, win 274, options [nop,nop,TS val 4141306 ecr 4140839], length 0
14:48:33.399576 IP 5.6.7.8.80 > 1.1.2.3.55328: Flags [.], seq 2897:5793, ack 115, win 227, options [nop,nop,TS val 4140839 ecr 4141305], length 2896
14:48:33.399596 IP 1.1.2.3.55328 > 5.6.7.8.80: Flags [.], ack 5793, win 319, options [nop,nop,TS val 4141306 ecr 4140839], length 0
14:48:33.399632 IP 5.6.7.8.80 > 1.1.2.3.55328: Flags [P.], seq 5793:11821, ack 115, win 227, options [nop,nop,TS val 4140839 ecr 4141305], length 6028
14:48:33.399647 IP 1.1.2.3.55328 > 5.6.7.8.80: Flags [.], ack 11821, win 413, options [nop,nop,TS val 4141306 ecr 4140839], length 0
14:48:33.405508 IP 1.1.2.3.55328 > 5.6.7.8.80: Flags [F.], seq 115, ack 11821, win 413, options [nop,nop,TS val 4141307 ecr 4140839], length 0
14:48:33.405913 IP 5.6.7.8.80 > 1.1.2.3.55328: Flags [F.], seq 11821, ack 116, win 227, options [nop,nop,TS val 4140841 ecr 4141307], length 0
14:48:33.405938 IP 1.1.2.3.55328 > 5.6.7.8.80: Flags [.], ack 11822, win 413, options [nop,nop,TS val 4141307 ecr 4140841], length 0
14:48:34.419570 IP 1.1.2.3.55329 > 5.6.7.8.80: Flags [S], seq 696141836, win 29200, options [mss 1460,sackOK,TS val 4141561 ecr 0,nop,wscale 7], length 0
14:48:34.419800 IP 5.6.7.8.80 > 1.1.2.3.55329: Flags [S.], seq 4102332044, ack 696141837, win 28960, options [mss 1460,sackOK,TS val 4141094 ecr 4141561,nop,wscale 7], length 0
14:48:34.419844 IP 1.1.2.3.55329 > 5.6.7.8.80: Flags [.], ack 1, win 229, options [nop,nop,TS val 4141561 ecr 4141094], length 0
14:48:34.419977 IP 1.1.2.3.55329 > 5.6.7.8.80: Flags [P.], seq 1:115, ack 1, win 229, options [nop,nop,TS val 4141561 ecr 4141094], length 114
14:48:34.420246 IP 5.6.7.8.80 > 1.1.2.3.55329: Flags [.], ack 115, win 227, options [nop,nop,TS val 4141094 ecr 4141561], length 0
14:48:34.420550 IP 5.6.7.8.80 > 1.1.2.3.55329: Flags [.], seq 1:4345, ack 115, win 227, options [nop,nop,TS val 4141094 ecr 4141561], length 4344
14:48:34.420570 IP 1.1.2.3.55329 > 5.6.7.8.80: Flags [.], ack 4345, win 296, options [nop,nop,TS val 4141561 ecr 4141094], length 0
14:48:34.420606 IP 5.6.7.8.80 > 1.1.2.3.55329: Flags [.], seq 4345:10137, ack 115, win 227, options [nop,nop,TS val 4141094 ecr 4141561], length 5792
14:48:34.420626 IP 1.1.2.3.55329 > 5.6.7.8.80: Flags [.], ack 10137, win 387, options [nop,nop,TS val 4141561 ecr 4141094], length 0
14:48:34.420659 IP 5.6.7.8.80 > 1.1.2.3.55329: Flags [P.], seq 10137:11821, ack 115, win 227, options [nop,nop,TS val 4141094 ecr 4141561], length 1684
14:48:34.420672 IP 1.1.2.3.55329 > 5.6.7.8.80: Flags [.], ack 11821, win 413, options [nop,nop,TS val 4141561 ecr 4141094], length 0
14:48:34.426532 IP 1.1.2.3.55329 > 5.6.7.8.80: Flags [F.], seq 115, ack 11821, win 413, options [nop,nop,TS val 4141562 ecr 4141094], length 0
14:48:34.427188 IP 5.6.7.8.80 > 1.1.2.3.55329: Flags [F.], seq 11821, ack 116, win 227, options [nop,nop,TS val 4141096 ecr 4141562], length 0
14:48:34.427208 IP 1.1.2.3.55329 > 5.6.7.8.80: Flags [.], ack 11822, win 413, options [nop,nop,TS val 4141562 ecr 4141096], length 0
14:48:35.440629 IP 1.1.2.3.55330 > 5.6.7.8.80: Flags [S], seq 4005248049, win 29200, options [mss 1460,sackOK,TS val 4141816 ecr 0,nop,wscale 7], length 0
14:48:35.440823 IP 5.6.7.8.80 > 1.1.2.3.55330: Flags [S.], seq 2631023979, ack 4005248050, win 28960, options [mss 1460,sackOK,TS val 4141349 ecr 4141816,nop,wscale 7], length 0
14:48:35.440851 IP 1.1.2.3.55330 > 5.6.7.8.80: Flags [.], ack 1, win 229, options [nop,nop,TS val 4141816 ecr 4141349], length 0
14:48:35.440972 IP 1.1.2.3.55330 > 5.6.7.8.80: Flags [P.], seq 1:115, ack 1, win 229, options [nop,nop,TS val 4141816 ecr 4141349], length 114
14:48:35.441172 IP 5.6.7.8.80 > 1.1.2.3.55330: Flags [.], ack 115, win 227, options [nop,nop,TS val 4141349 ecr 4141816], length 0
14:48:35.441476 IP 5.6.7.8.80 > 1.1.2.3.55330: Flags [.], seq 1:4345, ack 115, win 227, options [nop,nop,TS val 4141349 ecr 4141816], length 4344
14:48:35.441494 IP 1.1.2.3.55330 > 5.6.7.8.80: Flags [.], ack 4345, win 296, options [nop,nop,TS val 4141816 ecr 4141349], length 0
14:48:35.441537 IP 5.6.7.8.80 > 1.1.2.3.55330: Flags [P.], seq 4345:11821, ack 115, win 227, options [nop,nop,TS val 4141349 ecr 4141816], length 7476
14:48:35.441563 IP 1.1.2.3.55330 > 5.6.7.8.80: Flags [.], ack 11821, win 413, options [nop,nop,TS val 4141816 ecr 4141349], length 0
14:48:35.447574 IP 1.1.2.3.55330 > 5.6.7.8.80: Flags [F.], seq 115, ack 11821, win 413, options [nop,nop,TS val 4141818 ecr 4141349], length 0
14:48:35.448062 IP 5.6.7.8.80 > 1.1.2.3.55330: Flags [F.], seq 11821, ack 116, win 227, options [nop,nop,TS val 4141351 ecr 4141818], length 0
14:48:35.448087 IP 1.1.2.3.55330 > 5.6.7.8.80: Flags [.], ack 11822, win 413, options [nop,nop,TS val 4141818 ecr 4141351], length 0
14:48:36.463005 IP 1.1.2.3.55331 > 5.6.7.8.80: Flags [S], seq 608282310, win 29200, options [mss 1460,sackOK,TS val 4142071 ecr 0,nop,wscale 7], length 0
14:48:36.463248 IP 5.6.7.8.80 > 1.1.2.3.55331: Flags [S.], seq 1047197537, ack 608282311, win 28960, options [mss 1460,sackOK,TS val 4141605 ecr 4142071,nop,wscale 7], length 0
14:48:36.463294 IP 1.1.2.3.55331 > 5.6.7.8.80: Flags [.], ack 1, win 229, options [nop,nop,TS val 4142071 ecr 4141605], length 0
14:48:36.463446 IP 1.1.2.3.55331 > 5.6.7.8.80: Flags [P.], seq 1:115, ack 1, win 229, options [nop,nop,TS val 4142072 ecr 4141605], length 114
14:48:36.463643 IP 5.6.7.8.80 > 1.1.2.3.55331: Flags [.], ack 115, win 227, options [nop,nop,TS val 4141605 ecr 4142072], length 0
14:48:36.463897 IP 5.6.7.8.80 > 1.1.2.3.55331: Flags [.], seq 1:2897, ack 115, win 227, options [nop,nop,TS val 4141605 ecr 4142072], length 2896
14:48:36.463908 IP 1.1.2.3.55331 > 5.6.7.8.80: Flags [.], ack 2897, win 274, options [nop,nop,TS val 4142072 ecr 4141605], length 0
