14:55:06.726487 IP 1.1.2.3.55367 > 5.6.7.8.80: Flags [S], seq 165741585, win 29200, options [mss 1460,sackOK,TS val 4239637 ecr 0,nop,wscale 7], length 0
14:55:06.726764 IP 5.6.7.8.80 > 1.1.2.3.55367: Flags [S.], seq 1248014547, ack 165741586, win 28960, options [mss 1460,sackOK,TS val 4239171 ecr 4239637,nop,wscale 7], length 0
14:55:06.726813 IP 1.1.2.3.55367 > 5.6.7.8.80: Flags [.], ack 1, win 229, options [nop,nop,TS val 4239637 ecr 4239171], length 0
14:55:06.726909 IP 1.1.2.3.55367 > 5.6.7.8.80: Flags [P.], seq 1:115, ack 1, win 229, options [nop,nop,TS val 4239637 ecr 4239171], length 114
14:55:06.727111 IP 5.6.7.8.80 > 1.1.2.3.55367: Flags [.], ack 115, win 227, options [nop,nop,TS val 4239171 ecr 4239637], length 0
14:55:06.727566 IP 5.6.7.8.80 > 1.1.2.3.55367: Flags [.], seq 1:5793, ack 115, win 227, options [nop,nop,TS val 4239171 ecr 4239637], length 5792
14:55:06.727588 IP 1.1.2.3.55367 > 5.6.7.8.80: Flags [.], ack 5793, win 319, options [nop,nop,TS val 4239638 ecr 4239171], length 0
14:55:06.727622 IP 5.6.7.8.80 > 1.1.2.3.55367: Flags [P.], seq 5793:11821, ack 115, win 227, options [nop,nop,TS val 4239171 ecr 4239637], length 6028
14:55:06.727642 IP 1.1.2.3.55367 > 5.6.7.8.80: Flags [.], ack 11821, win 413, options [nop,nop,TS val 4239638 ecr 4239171], length 0
14:55:06.734539 IP 1.1.2.3.55367 > 5.6.7.8.80: Flags [F.], seq 115, ack 11821, win 413, options [nop,nop,TS val 4239639 ecr 4239171], length 0
14:55:06.734900 IP 5.6.7.8.80 > 1.1.2.3.55367: Flags [F.], seq 11821, ack 116, win 227, options [nop,nop,TS val 4239173 ecr 4239639], length 0
14:55:06.734931 IP 1.1.2.3.55367 > 5.6.7.8.80: Flags [.], ack 11822, win 413, options [nop,nop,TS val 4239639 ecr 4239173], length 0
14:55:07.746403 IP 1.1.2.3.55368 > 5.6.7.8.80: Flags [S], seq 3632667080, win 29200, options [mss 1460,sackOK,TS val 4239892 ecr 0,nop,wscale 7], length 0
14:55:07.746591 IP 5.6.7.8.80 > 1.1.2.3.55368: Flags [S.], seq 4280459682, ack 3632667081, win 28960, options [mss 1460,sackOK,TS val 4239426 ecr 4239892,nop,wscale 7], length 0
14:55:07.746639 IP 1.1.2.3.55368 > 5.6.7.8.80: Flags [.], ack 1, win 229, options [nop,nop,TS val 4239892 ecr 4239426], length 0
14:55:07.746775 IP 1.1.2.3.55368 > 5.6.7.8.80: Flags [P.], seq 1:115, ack 1, win 229, options [nop,nop,TS val 4239892 ecr 4239426], length 114
14:55:07.746988 IP 5.6.7.8.80 > 1.1.2.3.55368: Flags [.], ack 115, win 227, options [nop,nop,TS val 4239426 ecr 4239892], length 0
14:55:07.747291 IP 5.6.7.8.80 > 1.1.2.3.55368: Flags [.], seq 1:2897, ack 115, win 227, options [nop,nop,TS val 4239426 ecr 4239892], length 2896
14:55:07.747304 IP 1.1.2.3.55368 > 5.6.7.8.80: Flags [.], ack 2897, win 274, options [nop,nop,TS val 4239892 ecr 4239426], length 0
14:55:07.747362 IP 5.6.7.8.80 > 1.1.2.3.55368: Flags [.], seq 2897:8689, ack 115, win 227, options [nop,nop,TS val 4239426 ecr 4239892], length 5792
14:55:07.747382 IP 1.1.2.3.55368 > 5.6.7.8.80: Flags [.], ack 8689, win 364, options [nop,nop,TS val 4239893 ecr 4239426], length 0
14:55:07.747443 IP 5.6.7.8.80 > 1.1.2.3.55368: Flags [P.], seq 8689:11821, ack 115, win 227, options [nop,nop,TS val 4239426 ecr 4239892], length 3132
14:55:07.747461 IP 1.1.2.3.55368 > 5.6.7.8.80: Flags [.], ack 11821, win 413, options [nop,nop,TS val 4239893 ecr 4239426], length 0
14:55:07.753076 IP 1.1.2.3.55368 > 5.6.7.8.80: Flags [F.], seq 115, ack 11821, win 413, options [nop,nop,TS val 4239894 ecr 4239426], length 0
14:55:07.753628 IP 5.6.7.8.80 > 1.1.2.3.55368: Flags [F.], seq 11821, ack 116, win 227, options [nop,nop,TS val 4239427 ecr 4239894], length 0
14:55:07.753650 IP 1.1.2.3.55368 > 5.6.7.8.80: Flags [.], ack 11822, win 413, options [nop,nop,TS val 4239894 ecr 4239427], length 0
14:55:08.764901 IP 1.1.2.3.55369 > 5.6.7.8.80: Flags [S], seq 1334012489, win 29200, options [mss 1460,sackOK,TS val 4240147 ecr 0,nop,wscale 7], length 0
14:55:08.765117 IP 5.6.7.8.80 > 1.1.2.3.55369: Flags [S.], seq 1973715398, ack 1334012490, win 28960, options [mss 1460,sackOK,TS val 4239680 ecr 4240147,nop,wscale 7], length 0
14:55:08.765163 IP 1.1.2.3.55369 > 5.6.7.8.80: Flags [.], ack 1, win 229, options [nop,nop,TS val 4240147 ecr 4239680], length 0
14:55:08.765297 IP 1.1.2.3.55369 > 5.6.7.8.80: Flags [P.], seq 1:115, ack 1, win 229, options [nop,nop,TS val 4240147 ecr 4239680], length 114
14:55:08.765514 IP 5.6.7.8.80 > 1.1.2.3.55369: Flags [.], ack 115, win 227, options [nop,nop,TS val 4239680 ecr 4240147], length 0
14:55:08.765875 IP 5.6.7.8.80 > 1.1.2.3.55369: Flags [.], seq 1:8689, ack 115, win 227, options [nop,nop,TS val 4239681 ecr 4240147], length 8688
14:55:08.765898 IP 1.1.2.3.55369 > 5.6.7.8.80: Flags [.], ack 8689, win 364, options [nop,nop,TS val 4240147 ecr 4239681], length 0
14:55:08.765980 IP 5.6.7.8.80 > 1.1.2.3.55369: Flags [P.], seq 8689:11821, ack 115, win 227, options [nop,nop,TS val 4239681 ecr 4240147], length 3132
14:55:08.765999 IP 1.1.2.3.55369 > 5.6.7.8.80: Flags [.], ack 11821, win 413, options [nop,nop,TS val 4240147 ecr 4239681], length 0
14:55:08.771541 IP 1.1.2.3.55369 > 5.6.7.8.80: Flags [F.], seq 115, ack 11821, win 413, options [nop,nop,TS val 4240149 ecr 4239681], length 0
14:55:08.771954 IP 5.6.7.8.80 > 1.1.2.3.55369: Flags [F.], seq 11821, ack 116, win 227, options [nop,nop,TS val 4239682 ecr 4240149], length 0
14:55:08.771981 IP 1.1.2.3.55369 > 5.6.7.8.80: Flags [.], ack 11822, win 413, options [nop,nop,TS val 4240149 ecr 4239682], length 0
14:55:09.784671 IP 1.1.2.3.55370 > 5.6.7.8.80: Flags [S], seq 1407790744, win 29200, options [mss 1460,sackOK,TS val 4240402 ecr 0,nop,wscale 7], length 0
14:55:09.784846 IP 5.6.7.8.80 > 1.1.2.3.55370: Flags [S.], seq 3947551540, ack 1407790745, win 28960, options [mss 1460,sackOK,TS val 4239935 ecr 4240402,nop,wscale 7], length 0
14:55:09.784875 IP 1.1.2.3.55370 > 5.6.7.8.80: Flags [.], ack 1, win 229, options [nop,nop,TS val 4240402 ecr 4239935], length 0
14:55:09.784996 IP 1.1.2.3.55370 > 5.6.7.8.80: Flags [P.], seq 1:115, ack 1, win 229, options [nop,nop,TS val 4240402 ecr 4239935], length 114
14:55:09.785245 IP 5.6.7.8.80 > 1.1.2.3.55370: Flags [.], ack 115, win 227, options [nop,nop,TS val 4239935 ecr 4240402], length 0
14:55:09.785552 IP 5.6.7.8.80 > 1.1.2.3.55370: Flags [.], seq 1:5793, ack 115, win 227, options [nop,nop,TS val 4239935 ecr 4240402], length 5792
14:55:09.785572 IP 1.1.2.3.55370 > 5.6.7.8.80: Flags [.], ack 5793, win 319, options [nop,nop,TS val 4240402 ecr 4239935], length 0
14:55:09.785607 IP 5.6.7.8.80 > 1.1.2.3.55370: Flags [P.], seq 5793:11821, ack 115, win 227, options [nop,nop,TS val 4239935 ecr 4240402], length 6028
14:55:09.785624 IP 1.1.2.3.55370 > 5.6.7.8.80: Flags [.], ack 11821, win 413, options [nop,nop,TS val 4240402 ecr 4239935], length 0
14:55:09.791446 IP 1.1.2.3.55370 > 5.6.7.8.80: Flags [F.], seq 115, ack 11821, win 413, options [nop,nop,TS val 4240404 ecr 4239935], length 0
14:55:09.791884 IP 5.6.7.8.80 > 1.1.2.3.55370: Flags [F.], seq 11821, ack 116, win 227, options [nop,nop,TS val 4239937 ecr 4240404], length 0
14:55:09.791909 IP 1.1.2.3.55370 > 5.6.7.8.80: Flags [.], ack 11822, win 413, options [nop,nop,TS val 4240404 ecr 4239937], length 0
14:55:10.804577 IP 1.1.2.3.55371 > 5.6.7.8.80: Flags [S], seq 452491659, win 29200, options [mss 1460,sackOK,TS val 4240657 ecr 0,nop,wscale 7], length 0
14:55:10.804772 IP 5.6.7.8.80 > 1.1.2.3.55371: Flags [S.], seq 282313316, ack 452491660, win 28960, options [mss 1460,sackOK,TS val 4240190 ecr 4240657,nop,wscale 7], length 0
14:55:10.804818 IP 1.1.2.3.55371 > 5.6.7.8.80: Flags [.], ack 1, win 229, options [nop,nop,TS val 4240657 ecr 4240190], length 0
14:55:10.804954 IP 1.1.2.3.55371 > 5.6.7.8.80: Flags [P.], seq 1:115, ack 1, win 229, options [nop,nop,TS val 4240657 ecr 4240190], length 114
14:55:10.805119 IP 5.6.7.8.80 > 1.1.2.3.55371: Flags [.], ack 115, win 227, options [nop,nop,TS val 4240190 ecr 4240657], length 0
14:55:10.805426 IP 5.6.7.8.80 > 1.1.2.3.55371: Flags [.], seq 1:4345, ack 115, win 227, options [nop,nop,TS val 4240190 ecr 4240657], length 4344
14:55:10.805446 IP 1.1.2.3.55371 > 5.6.7.8.80: Flags [.], ack 4345, win 296, options [nop,nop,TS val 4240657 ecr 4240190], length 0
14:55:10.805479 IP 5.6.7.8.80 > 1.1.2.3.55371: Flags [.], seq 4345:8689, ack 115, win 227, options [nop,nop,TS val 4240190 ecr 4240657], length 4344
14:55:10.805495 IP 1.1.2.3.55371 > 5.6.7.8.80: Flags [.], ack 8689, win 364, options [nop,nop,TS val 4240657 ecr 4240190], length 0
14:55:10.805533 IP 5.6.7.8.80 > 1.1.2.3.55371: Flags [P.], seq 8689:11821, ack 115, win 227, options [nop,nop,TS val 4240190 ecr 4240657], length 3132
14:55:10.805552 IP 1.1.2.3.55371 > 5.6.7.8.80: Flags [.], ack 11821, win 413, options [nop,nop,TS val 4240657 ecr 4240190], length 0
14:55:10.810952 IP 1.1.2.3.55371 > 5.6.7.8.80: Flags [F.], seq 115, ack 11821, win 413, options [nop,nop,TS val 4240658 ecr 4240190], length 0
14:55:10.811510 IP 5.6.7.8.80 > 1.1.2.3.55371: Flags [F.], seq 11821, ack 116, win 227, options [nop,nop,TS val 4240192 ecr 4240658], length 0
14:55:10.811530 IP 1.1.2.3.55371 > 5.6.7.8.80: Flags [.], ack 11822, win 413, options [nop,nop,TS val 4240659 ecr 4240192], length 0
14:55:11.824069 IP 1.1.2.3.55372 > 5.6.7.8.80: Flags [S], seq 4065860895, win 29200, options [mss 1460,sackOK,TS val 4240912 ecr 0,nop,wscale 7], length 0
14:55:11.824250 IP 5.6.7.8.80 > 1.1.2.3.55372: Flags [S.], seq 3699944675, ack 4065860896, win 28960, options [mss 1460,sackOK,TS val 4240445 ecr 4240912,nop,wscale 7], length 0
14:55:11.824276 IP 1.1.2.3.55372 > 5.6.7.8.80: Flags [.], ack 1, win 229, options [nop,nop,TS val 4240912 ecr 4240445], length 0
14:55:11.824396 IP 1.1.2.3.55372 > 5.6.7.8.80: Flags [P.], seq 1:115, ack 1, win 229, options [nop,nop,TS val 4240912 ecr 4240445], length 114
14:55:11.824599 IP 5.6.7.8.80 > 1.1.2.3.55372: Flags [.], ack 115, win 227, options [nop,nop,TS val 4240445 ecr 4240912], length 0
14:55:11.824849 IP 5.6.7.8.80 > 1.1.2.3.55372: Flags [.], seq 1:1449, ack 115, win 227, options [nop,nop,TS val 4240445 ecr 4240912], length 1448
14:55:11.824858 IP 1.1.2.3.55372 > 5.6.7.8.80: Flags [.], ack 1449, win 251, options [nop,nop,TS val 4240912 ecr 4240445], length 0
14:55:11.824903 IP 5.6.7.8.80 > 1.1.2.3.55372: Flags [.], seq 1449:2897, ack 115, win 227, options [nop,nop,TS val 4240445 ecr 4240912], length 1448
14:55:11.824920 IP 1.1.2.3.55372 > 5.6.7.8.80: Flags [.], ack 2897, win 274, options [nop,nop,TS val 4240912 ecr 4240445], length 0
14:55:11.824967 IP 5.6.7.8.80 > 1.1.2.3.55372: Flags [.], seq 2897:10137, ack 115, win 227, options [nop,nop,TS val 4240445 ecr 4240912], length 7240
14:55:11.824989 IP 1.1.2.3.55372 > 5.6.7.8.80: Flags [.], ack 10137, win 387, options [nop,nop,TS val 4240912 ecr 4240445], length 0
14:55:11.825054 IP 5.6.7.8.80 > 1.1.2.3.55372: Flags [P.], seq 10137:11821, ack 115, win 227, options [nop,nop,TS val 4240445 ecr 4240912], length 1684
14:55:11.825072 IP 1.1.2.3.55372 > 5.6.7.8.80: Flags [.], ack 11821, win 413, options [nop,nop,TS val 4240912 ecr 4240445], length 0
14:55:11.830654 IP 1.1.2.3.55372 > 5.6.7.8.80: Flags [F.], seq 115, ack 11821, win 413, options [nop,nop,TS val 4240913 ecr 4240445], length 0
14:55:11.830993 IP 5.6.7.8.80 > 1.1.2.3.55372: Flags [F.], seq 11821, ack 116, win 227, options [nop,nop,TS val 4240447 ecr 4240913], length 0
14:55:11.831020 IP 1.1.2.3.55372 > 5.6.7.8.80: Flags [.], ack 11822, win 413, options [nop,nop,TS val 4240913 ecr 4240447], length 0
14:55:12.847221 IP 1.1.2.3.55373 > 5.6.7.8.80: Flags [S], seq 3401832160, win 29200, options [mss 1460,sackOK,TS val 4241167 ecr 0,nop,wscale 7], length 0
14:55:12.847420 IP 5.6.7.8.80 > 1.1.2.3.55373: Flags [S.], seq 391151156, ack 3401832161, win 28960, options [mss 1460,sackOK,TS val 4240701 ecr 4241167,nop,wscale 7], length 0
14:55:12.847449 IP 1.1.2.3.55373 > 5.6.7.8.80: Flags [.], ack 1, win 229, options [nop,nop,TS val 4241168 ecr 4240701], length 0
14:55:12.847568 IP 1.1.2.3.55373 > 5.6.7.8.80: Flags [P.], seq 1:115, ack 1, win 229, options [nop,nop,TS val 4241168 ecr 4240701], length 114
14:55:12.847769 IP 5.6.7.8.80 > 1.1.2.3.55373: Flags [.], ack 115, win 227, options [nop,nop,TS val 4240701 ecr 4241168], length 0
14:55:12.848074 IP 5.6.7.8.80 > 1.1.2.3.55373: Flags [.], seq 1:5793, ack 115, win 227, options [nop,nop,TS val 4240701 ecr 4241168], length 5792
14:55:12.848093 IP 1.1.2.3.55373 > 5.6.7.8.80: Flags [.], ack 5793, win 319, options [nop,nop,TS val 4241168 ecr 4240701], length 0
14:55:12.848128 IP 5.6.7.8.80 > 1.1.2.3.55373: Flags [P.], seq 5793:11821, ack 115, win 227, options [nop,nop,TS val 4240701 ecr 4241168], length 6028
14:55:12.848144 IP 1.1.2.3.55373 > 5.6.7.8.80: Flags [.], ack 11821, win 413, options [nop,nop,TS val 4241168 ecr 4240701], length 0
14:55:12.853816 IP 1.1.2.3.55373 > 5.6.7.8.80: Flags [F.], seq 115, ack 11821, win 413, options [nop,nop,TS val 4241169 ecr 4240701], length 0
14:55:12.854159 IP 5.6.7.8.80 > 1.1.2.3.55373: Flags [F.], seq 11821, ack 116, win 227, options [nop,nop,TS val 4240703 ecr 4241169], length 0
14:55:12.854192 IP 1.1.2.3.55373 > 5.6.7.8.80: Flags [.], ack 11822, win 413, options [nop,nop,TS val 4241169 ecr 4240703], length 0
14:55:13.866977 IP 1.1.2.3.55374 > 5.6.7.8.80: Flags [S], seq 4212317515, win 29200, options [mss 1460,sackOK,TS val 4241422 ecr 0,nop,wscale 7], length 0
14:55:13.867207 IP 5.6.7.8.80 > 1.1.2.3.55374: Flags [S.], seq 1021761863, ack 4212317516, win 28960, options [mss 1460,sackOK,TS val 4240956 ecr 4241422,nop,wscale 7], length 0
14:55:13.867236 IP 1.1.2.3.55374 > 5.6.7.8.80: Flags [.], ack 1, win 229, options [nop,nop,TS val 4241422 ecr 4240956], length 0
14:55:13.867374 IP 1.1.2.3.55374 > 5.6.7.8.80: Flags [P.], seq 1:115, ack 1, win 229, options [nop,nop,TS val 4241423 ecr 4240956], length 114
14:55:13.867557 IP 5.6.7.8.80 > 1.1.2.3.55374: Flags [.], ack 115, win 227, options [nop,nop,TS val 4240956 ecr 4241423], length 0
14:55:13.867859 IP 5.6.7.8.80 > 1.1.2.3.55374: Flags [.], seq 1:2897, ack 115, win 227, options [nop,nop,TS val 4240956 ecr 4241423], length 2896
14:55:13.867870 IP 1.1.2.3.55374 > 5.6.7.8.80: Flags [.], ack 2897, win 274, options [nop,nop,TS val 4241423 ecr 4240956], length 0
14:55:13.867924 IP 5.6.7.8.80 > 1.1.2.3.55374: Flags [.], seq 2897:10137, ack 115, win 227, options [nop,nop,TS val 4240956 ecr 4241423], length 7240
14:55:13.867956 IP 1.1.2.3.55374 > 5.6.7.8.80: Flags [.], ack 10137, win 387, options [nop,nop,TS val 4241423 ecr 4240956], length 0
14:55:13.868011 IP 5.6.7.8.80 > 1.1.2.3.55374: Flags [P.], seq 10137:11821, ack 115, win 227, options [nop,nop,TS val 4240956 ecr 4241423], length 1684
14:55:13.868031 IP 1.1.2.3.55374 > 5.6.7.8.80: Flags [.], ack 11821, win 413, options [nop,nop,TS val 4241423 ecr 4240956], length 0
14:55:13.873896 IP 1.1.2.3.55374 > 5.6.7.8.80: Flags [F.], seq 115, ack 11821, win 413, options [nop,nop,TS val 4241424 ecr 4240956], length 0
14:55:13.874499 IP 5.6.7.8.80 > 1.1.2.3.55374: Flags [F.], seq 11821, ack 116, win 227, options [nop,nop,TS val 4240958 ecr 4241424], length 0
14:55:13.874516 IP 1.1.2.3.55374 > 5.6.7.8.80: Flags [.], ack 11822, win 413, options [nop,nop,TS val 4241424 ecr 4240958], length 0
14:55:14.886993 IP 1.1.2.3.55375 > 5.6.7.8.80: Flags [S], seq 1152363086, win 29200, options [mss 1460,sackOK,TS val 4241677 ecr 0,nop,wscale 7], length 0
14:55:14.887225 IP 5.6.7.8.80 > 1.1.2.3.55375: Flags [S.], seq 869639479, ack 1152363087, win 28960, options [mss 1460,sackOK,TS val 4241211 ecr 4241677,nop,wscale 7], length 0
14:55:14.887253 IP 1.1.2.3.55375 > 5.6.7.8.80: Flags [.], ack 1, win 229, options [nop,nop,TS val 4241677 ecr 4241211], length 0
14:55:14.887397 IP 1.1.2.3.55375 > 5.6.7.8.80: Flags [P.], seq 1:115, ack 1, win 229, options [nop,nop,TS val 4241678 ecr 4241211], length 114
14:55:14.887625 IP 5.6.7.8.80 > 1.1.2.3.55375: Flags [.], ack 115, win 227, options [nop,nop,TS val 4241211 ecr 4241678], length 0
14:55:14.887928 IP 5.6.7.8.80 > 1.1.2.3.55375: Flags [.], seq 1:5793, ack 115, win 227, options [nop,nop,TS val 4241211 ecr 4241678], length 5792
14:55:14.887948 IP 1.1.2.3.55375 > 5.6.7.8.80: Flags [.], ack 5793, win 319, options [nop,nop,TS val 4241678 ecr 4241211], length 0
14:55:14.887981 IP 5.6.7.8.80 > 1.1.2.3.55375: Flags [P.], seq 5793:11821, ack 115, win 227, options [nop,nop,TS val 4241211 ecr 4241678], length 6028
14:55:14.887998 IP 1.1.2.3.55375 > 5.6.7.8.80: Flags [.], ack 11821, win 413, options [nop,nop,TS val 4241678 ecr 4241211], length 0
14:55:14.893640 IP 1.1.2.3.55375 > 5.6.7.8.80: Flags [F.], seq 115, ack 11821, win 413, options [nop,nop,TS val 4241679 ecr 4241211], length 0
14:55:14.894021 IP 5.6.7.8.80 > 1.1.2.3.55375: Flags [F.], seq 11821, ack 116, win 227, options [nop,nop,TS val 4241213 ecr 4241679], length 0
14:55:14.894046 IP 1.1.2.3.55375 > 5.6.7.8.80: Flags [.], ack 11822, win 413, options [nop,nop,TS val 4241679 ecr 4241213], length 0
14:55:15.907927 IP 1.1.2.3.55376 > 5.6.7.8.80: Flags [S], seq 2457740710, win 29200, options [mss 1460,sackOK,TS val 4241933 ecr 0,nop,wscale 7], length 0
14:55:15.908148 IP 5.6.7.8.80 > 1.1.2.3.55376: Flags [S.], seq 1227544086, ack 2457740711, win 28960, options [mss 1460,sackOK,TS val 4241466 ecr 4241933,nop,wscale 7], length 0
14:55:15.908176 IP 1.1.2.3.55376 > 5.6.7.8.80: Flags [.], ack 1, win 229, options [nop,nop,TS val 4241933 ecr 4241466], length 0
14:55:15.908294 IP 1.1.2.3.55376 > 5.6.7.8.80: Flags [P.], seq 1:115, ack 1, win 229, options [nop,nop,TS val 4241933 ecr 4241466], length 114
14:55:15.908548 IP 5.6.7.8.80 > 1.1.2.3.55376: Flags [.], ack 115, win 227, options [nop,nop,TS val 4241466 ecr 4241933], length 0
14:55:15.908855 IP 5.6.7.8.80 > 1.1.2.3.55376: Flags [.], seq 1:5793, ack 115, win 227, options [nop,nop,TS val 4241466 ecr 4241933], length 5792
14:55:15.908874 IP 1.1.2.3.55376 > 5.6.7.8.80: Flags [.], ack 5793, win 319, options [nop,nop,TS val 4241933 ecr 4241466], length 0
14:55:15.908905 IP 5.6.7.8.80 > 1.1.2.3.55376: Flags [P.], seq 5793:11821, ack 115, win 227, options [nop,nop,TS val 4241466 ecr 4241933], length 6028
14:55:15.908923 IP 1.1.2.3.55376 > 5.6.7.8.80: Flags [.], ack 11821, win 413, options [nop,nop,TS val 4241933 ecr 4241466], length 0
14:55:15.914600 IP 1.1.2.3.55376 > 5.6.7.8.80: Flags [F.], seq 115, ack 11821, win 413, options [nop,nop,TS val 4241934 ecr 4241466], length 0
14:55:15.915192 IP 5.6.7.8.80 > 1.1.2.3.55376: Flags [F.], seq 11821, ack 116, win 227, options [nop,nop,TS val 4241468 ecr 4241934], length 0
14:55:15.915212 IP 1.1.2.3.55376 > 5.6.7.8.80: Flags [.], ack 11822, win 413, options [nop,nop,TS val 4241934 ecr 4241468], length 0
14:55:16.928796 IP 1.1.2.3.55377 > 5.6.7.8.80: Flags [S], seq 1753472223, win 29200, options [mss 1460,sackOK,TS val 4242188 ecr 0,nop,wscale 7], length 0
14:55:16.929027 IP 5.6.7.8.80 > 1.1.2.3.55377: Flags [S.], seq 189035095, ack 1753472224, win 28960, options [mss 1460,sackOK,TS val 4241721 ecr 4242188,nop,wscale 7], length 0
14:55:16.929058 IP 1.1.2.3.55377 > 5.6.7.8.80: Flags [.], ack 1, win 229, options [nop,nop,TS val 4242188 ecr 4241721], length 0
14:55:16.929182 IP 1.1.2.3.55377 > 5.6.7.8.80: Flags [P.], seq 1:115, ack 1, win 229, options [nop,nop,TS val 4242188 ecr 4241721], length 114
14:55:16.929376 IP 5.6.7.8.80 > 1.1.2.3.55377: Flags [.], ack 115, win 227, options [nop,nop,TS val 4241721 ecr 4242188], length 0
14:55:16.929629 IP 5.6.7.8.80 > 1.1.2.3.55377: Flags [.], seq 1:2897, ack 115, win 227, options [nop,nop,TS val 4241721 ecr 4242188], length 2896
14:55:16.929641 IP 1.1.2.3.55377 > 5.6.7.8.80: Flags [.], ack 2897, win 274, options [nop,nop,TS val 4242188 ecr 4241721], length 0
14:55:16.929683 IP 5.6.7.8.80 > 1.1.2.3.55377: Flags [.], seq 2897:5793, ack 115, win 227, options [nop,nop,TS val 4241721 ecr 4242188], length 2896
14:55:16.929702 IP 1.1.2.3.55377 > 5.6.7.8.80: Flags [.], ack 5793, win 319, options [nop,nop,TS val 4242188 ecr 4241721], length 0
14:55:16.929740 IP 5.6.7.8.80 > 1.1.2.3.55377: Flags [P.], seq 5793:11821, ack 115, win 227, options [nop,nop,TS val 4241721 ecr 4242188], length 6028
14:55:16.929756 IP 1.1.2.3.55377 > 5.6.7.8.80: Flags [.], ack 11821, win 413, options [nop,nop,TS val 4242188 ecr 4241721], length 0
14:55:16.935279 IP 1.1.2.3.55377 > 5.6.7.8.80: Flags [F.], seq 115, ack 11821, win 413, options [nop,nop,TS val 4242189 ecr 4241721], length 0
14:55:16.935770 IP 5.6.7.8.80 > 1.1.2.3.55377: Flags [F.], seq 11821, ack 116, win 227, options [nop,nop,TS val 4241723 ecr 4242189], length 0
14:55:16.935796 IP 1.1.2.3.55377 > 5.6.7.8.80: Flags [.], ack 11822, win 413, options [nop,nop,TS val 4242190 ecr 4241723], length 0
14:55:17.949713 IP 1.1.2.3.55378 > 5.6.7.8.80: Flags [S], seq 4103009039, win 29200, options [mss 1460,sackOK,TS val 4242443 ecr 0,nop,wscale 7], length 0
14:55:17.950008 IP 5.6.7.8.80 > 1.1.2.3.55378: Flags [S.], seq 3841635381, ack 4103009040, win 28960, options [mss 1460,sackOK,TS val 4241977 ecr 4242443,nop,wscale 7], length 0
14:55:17.950054 IP 1.1.2.3.55378 > 5.6.7.8.80: Flags [.], ack 1, win 229, options [nop,nop,TS val 4242443 ecr 4241977], length 0
14:55:17.950188 IP 1.1.2.3.55378 > 5.6.7.8.80: Flags [P.], seq 1:115, ack 1, win 229, options [nop,nop,TS val 4242443 ecr 4241977], length 114
14:55:17.950403 IP 5.6.7.8.80 > 1.1.2.3.55378: Flags [.], ack 115, win 227, options [nop,nop,TS val 4241977 ecr 4242443], length 0
14:55:17.950709 IP 5.6.7.8.80 > 1.1.2.3.55378: Flags [.], seq 1:5793, ack 115, win 227, options [nop,nop,TS val 4241977 ecr 4242443], length 5792
14:55:17.950731 IP 1.1.2.3.55378 > 5.6.7.8.80: Flags [.], ack 5793, win 319, options [nop,nop,TS val 4242443 ecr 4241977], length 0
14:55:17.950763 IP 5.6.7.8.80 > 1.1.2.3.55378: Flags [P.], seq 5793:11821, ack 115, win 227, options [nop,nop,TS val 4241977 ecr 4242443], length 6028
14:55:17.950782 IP 1.1.2.3.55378 > 5.6.7.8.80: Flags [.], ack 11821, win 413, options [nop,nop,TS val 4242443 ecr 4241977], length 0
14:55:17.956215 IP 1.1.2.3.55378 > 5.6.7.8.80: Flags [F.], seq 115, ack 11821, win 413, options [nop,nop,TS val 4242445 ecr 4241977], length 0
14:55:17.956543 IP 5.6.7.8.80 > 1.1.2.3.55378: Flags [F.], seq 11821, ack 116, win 227, options [nop,nop,TS val 4241978 ecr 4242445], length 0
14:55:17.956572 IP 1.1.2.3.55378 > 5.6.7.8.80: Flags [.], ack 11822, win 413, options [nop,nop,TS val 4242445 ecr 4241978], length 0
14:55:18.977461 IP 1.1.2.3.55379 > 5.6.7.8.80: Flags [S], seq 35774320, win 29200, options [mss 1460,sackOK,TS val 4242700 ecr 0,nop,wscale 7], length 0
14:55:18.977703 IP 5.6.7.8.80 > 1.1.2.3.55379: Flags [S.], seq 3540151904, ack 35774321, win 28960, options [mss 1460,sackOK,TS val 4242233 ecr 4242700,nop,wscale 7], length 0
14:55:18.977733 IP 1.1.2.3.55379 > 5.6.7.8.80: Flags [.], ack 1, win 229, options [nop,nop,TS val 4242700 ecr 4242233], length 0
14:55:18.977854 IP 1.1.2.3.55379 > 5.6.7.8.80: Flags [P.], seq 1:115, ack 1, win 229, options [nop,nop,TS val 4242700 ecr 4242233], length 114
14:55:18.978053 IP 5.6.7.8.80 > 1.1.2.3.55379: Flags [.], ack 115, win 227, options [nop,nop,TS val 4242234 ecr 4242700], length 0
14:55:18.978406 IP 5.6.7.8.80 > 1.1.2.3.55379: Flags [.], seq 1:4345, ack 115, win 227, options [nop,nop,TS val 4242234 ecr 4242700], length 4344
14:55:18.978424 IP 1.1.2.3.55379 > 5.6.7.8.80: Flags [.], ack 4345, win 296, options [nop,nop,TS val 4242700 ecr 4242234], length 0
14:55:18.978468 IP 5.6.7.8.80 > 1.1.2.3.55379: Flags [P.], seq 4345:11821, ack 115, win 227, options [nop,nop,TS val 4242234 ecr 4242700], length 7476
14:55:18.978494 IP 1.1.2.3.55379 > 5.6.7.8.80: Flags [.], ack 11821, win 413, options [nop,nop,TS val 4242700 ecr 4242234], length 0
14:55:18.984107 IP 1.1.2.3.55379 > 5.6.7.8.80: Flags [F.], seq 115, ack 11821, win 413, options [nop,nop,TS val 4242702 ecr 4242234], length 0
14:55:18.984492 IP 5.6.7.8.80 > 1.1.2.3.55379: Flags [F.], seq 11821, ack 116, win 227, options [nop,nop,TS val 4242235 ecr 4242702], length 0
14:55:18.984517 IP 1.1.2.3.55379 > 5.6.7.8.80: Flags [.], ack 11822, win 413, options [nop,nop,TS val 4242702 ecr 4242235], length 0
14:55:19.998571 IP 1.1.2.3.55380 > 5.6.7.8.80: Flags [S], seq 2986240743, win 29200, options [mss 1460,sackOK,TS val 4242955 ecr 0,nop,wscale 7], length 0
14:55:19.998791 IP 5.6.7.8.80 > 1.1.2.3.55380: Flags [S.], seq 1909805594, ack 2986240744, win 28960, options [mss 1460,sackOK,TS val 4242489 ecr 4242955,nop,wscale 7], length 0
14:55:19.998820 IP 1.1.2.3.55380 > 5.6.7.8.80: Flags [.], ack 1, win 229, options [nop,nop,TS val 4242955 ecr 4242489], length 0
14:55:19.998938 IP 1.1.2.3.55380 > 5.6.7.8.80: Flags [P.], seq 1:115, ack 1, win 229, options [nop,nop,TS val 4242955 ecr 4242489], length 114
14:55:19.999190 IP 5.6.7.8.80 > 1.1.2.3.55380: Flags [.], ack 115, win 227, options [nop,nop,TS val 4242489 ecr 4242955], length 0
14:55:19.999444 IP 5.6.7.8.80 > 1.1.2.3.55380: Flags [.], seq 1:2897, ack 115, win 227, options [nop,nop,TS val 4242489 ecr 4242955], length 2896
14:55:19.999457 IP 1.1.2.3.55380 > 5.6.7.8.80: Flags [.], ack 2897, win 274, options [nop,nop,TS val 4242956 ecr 4242489], length 0
14:55:19.999511 IP 5.6.7.8.80 > 1.1.2.3.55380: Flags [.], seq 2897:10137, ack 115, win 227, options [nop,nop,TS val 4242489 ecr 4242955], length 7240
14:55:19.999541 IP 1.1.2.3.55380 > 5.6.7.8.80: Flags [.], ack 10137, win 387, options [nop,nop,TS val 4242956 ecr 4242489], length 0
14:55:19.999593 IP 5.6.7.8.80 > 1.1.2.3.55380: Flags [P.], seq 10137:11821, ack 115, win 227, options [nop,nop,TS val 4242489 ecr 4242955], length 1684
14:55:19.999613 IP 1.1.2.3.55380 > 5.6.7.8.80: Flags [.], ack 11821, win 413, options [nop,nop,TS val 4242956 ecr 4242489], length 0
14:55:20.005133 IP 1.1.2.3.55380 > 5.6.7.8.80: Flags [F.], seq 115, ack 11821, win 413, options [nop,nop,TS val 4242957 ecr 4242489], length 0
14:55:20.005579 IP 5.6.7.8.80 > 1.1.2.3.55380: Flags [F.], seq 11821, ack 116, win 227, options [nop,nop,TS val 4242490 ecr 4242957], length 0
14:55:20.005603 IP 1.1.2.3.55380 > 5.6.7.8.80: Flags [.], ack 11822, win 413, options [nop,nop,TS val 4242957 ecr 4242490], length 0
14:55:21.019480 IP 1.1.2.3.55381 > 5.6.7.8.80: Flags [S], seq 1779265165, win 29200, options [mss 1460,sackOK,TS val 4243211 ecr 0,nop,wscale 7], length 0
14:55:21.019717 IP 5.6.7.8.80 > 1.1.2.3.55381: Flags [S.], seq 3065826766, ack 1779265166, win 28960, options [mss 1460,sackOK,TS val 4242744 ecr 4243211,nop,wscale 7], length 0
14:55:21.019745 IP 1.1.2.3.55381 > 5.6.7.8.80: Flags [.], ack 1, win 229, options [nop,nop,TS val 4243211 ecr 4242744], length 0
14:55:21.019866 IP 1.1.2.3.55381 > 5.6.7.8.80: Flags [P.], seq 1:115, ack 1, win 229, options [nop,nop,TS val 4243211 ecr 4242744], length 114
14:55:21.020067 IP 5.6.7.8.80 > 1.1.2.3.55381: Flags [.], ack 115, win 227, options [nop,nop,TS val 4242744 ecr 4243211], length 0
14:55:21.020316 IP 5.6.7.8.80 > 1.1.2.3.55381: Flags [.], seq 1:1449, ack 115, win 227, options [nop,nop,TS val 4242744 ecr 4243211], length 1448
14:55:21.020326 IP 1.1.2.3.55381 > 5.6.7.8.80: Flags [.], ack 1449, win 251, options [nop,nop,TS val 4243211 ecr 4242744], length 0
14:55:21.020384 IP 5.6.7.8.80 > 1.1.2.3.55381: Flags [.], seq 1449:8689, ack 115, win 227, options [nop,nop,TS val 4242744 ecr 4243211], length 7240
14:55:21.020409 IP 1.1.2.3.55381 > 5.6.7.8.80: Flags [.], ack 8689, win 364, options [nop,nop,TS val 4243211 ecr 4242744], length 0
14:55:21.020471 IP 5.6.7.8.80 > 1.1.2.3.55381: Flags [P.], seq 8689:11821, ack 115, win 227, options [nop,nop,TS val 4242744 ecr 4243211], length 3132
14:55:21.020492 IP 1.1.2.3.55381 > 5.6.7.8.80: Flags [.], ack 11821, win 413, options [nop,nop,TS val 4243211 ecr 4242744], length 0
14:55:21.026111 IP 1.1.2.3.55381 > 5.6.7.8.80: Flags [F.], seq 115, ack 11821, win 413, options [nop,nop,TS val 4243212 ecr 4242744], length 0
14:55:21.026457 IP 5.6.7.8.80 > 1.1.2.3.55381: Flags [F.], seq 11821, ack 116, win 227, options [nop,nop,TS val 4242746 ecr 4243212], length 0
14:55:21.026491 IP 1.1.2.3.55381 > 5.6.7.8.80: Flags [.], ack 11822, win 413, options [nop,nop,TS val 4243212 ecr 4242746], length 0
14:55:22.040245 IP 1.1.2.3.55382 > 5.6.7.8.80: Flags [S], seq 288557413, win 29200, options [mss 1460,sackOK,TS val 4243466 ecr 0,nop,wscale 7], length 0
14:55:22.040493 IP 5.6.7.8.80 > 1.1.2.3.55382: Flags [S.], seq 2149014622, ack 288557414, win 28960, options [mss 1460,sackOK,TS val 4242999 ecr 4243466,nop,wscale 7], length 0
14:55:22.040520 IP 1.1.2.3.55382 > 5.6.7.8.80: Flags [.], ack 1, win 229, options [nop,nop,TS val 4243466 ecr 4242999], length 0
14:55:22.040640 IP 1.1.2.3.55382 > 5.6.7.8.80: Flags [P.], seq 1:115, ack 1, win 229, options [nop,nop,TS val 4243466 ecr 4242999], length 114
14:55:22.040843 IP 5.6.7.8.80 > 1.1.2.3.55382: Flags [.], ack 115, win 227, options [nop,nop,TS val 4242999 ecr 4243466], length 0
14:55:22.041145 IP 5.6.7.8.80 > 1.1.2.3.55382: Flags [.], seq 1:2897, ack 115, win 227, options [nop,nop,TS val 4242999 ecr 4243466], length 2896
14:55:22.041156 IP 1.1.2.3.55382 > 5.6.7.8.80: Flags [.], ack 2897, win 274, options [nop,nop,TS val 4243466 ecr 4242999], length 0
14:55:22.041201 IP 5.6.7.8.80 > 1.1.2.3.55382: Flags [.], seq 2897:7241, ack 115, win 227, options [nop,nop,TS val 4242999 ecr 4243466], length 4344
14:55:22.041220 IP 1.1.2.3.55382 > 5.6.7.8.80: Flags [.], ack 7241, win 342, options [nop,nop,TS val 4243466 ecr 4242999], length 0
14:55:22.041252 IP 5.6.7.8.80 > 1.1.2.3.55382: Flags [P.], seq 7241:11821, ack 115, win 227, options [nop,nop,TS val 4242999 ecr 4243466], length 4580
14:55:22.041265 IP 1.1.2.3.55382 > 5.6.7.8.80: Flags [.], ack 11821, win 413, options [nop,nop,TS val 4243466 ecr 4242999], length 0
14:55:22.047025 IP 1.1.2.3.55382 > 5.6.7.8.80: Flags [F.], seq 115, ack 11821, win 413, options [nop,nop,TS val 4243467 ecr 4242999], length 0
14:55:22.047482 IP 5.6.7.8.80 > 1.1.2.3.55382: Flags [F.], seq 11821, ack 116, win 227, options [nop,nop,TS val 4243001 ecr 4243467], length 0
14:55:22.047507 IP 1.1.2.3.55382 > 5.6.7.8.80: Flags [.], ack 11822, win 413, options [nop,nop,TS val 4243468 ecr 4243001], length 0
14:55:23.061223 IP 1.1.2.3.55383 > 5.6.7.8.80: Flags [S], seq 1106786819, win 29200, options [mss 1460,sackOK,TS val 4243721 ecr 0,nop,wscale 7], length 0
14:55:23.061420 IP 5.6.7.8.80 > 1.1.2.3.55383: Flags [S.], seq 4225385916, ack 1106786820, win 28960, options [mss 1460,sackOK,TS val 4243254 ecr 4243721,nop,wscale 7], length 0
14:55:23.061453 IP 1.1.2.3.55383 > 5.6.7.8.80: Flags [.], ack 1, win 229, options [nop,nop,TS val 4243721 ecr 4243254], length 0
14:55:23.061579 IP 1.1.2.3.55383 > 5.6.7.8.80: Flags [P.], seq 1:115, ack 1, win 229, options [nop,nop,TS val 4243721 ecr 4243254], length 114
14:55:23.061768 IP 5.6.7.8.80 > 1.1.2.3.55383: Flags [.], ack 115, win 227, options [nop,nop,TS val 4243255 ecr 4243721], length 0
14:55:23.062025 IP 5.6.7.8.80 > 1.1.2.3.55383: Flags [.], seq 1:2897, ack 115, win 227, options [nop,nop,TS val 4243255 ecr 4243721], length 2896
14:55:23.062038 IP 1.1.2.3.55383 > 5.6.7.8.80: Flags [.], ack 2897, win 274, options [nop,nop,TS val 4243721 ecr 4243255], length 0
14:55:23.062077 IP 5.6.7.8.80 > 1.1.2.3.55383: Flags [.], seq 2897:7241, ack 115, win 227, options [nop,nop,TS val 4243255 ecr 4243721], length 4344
14:55:23.062098 IP 1.1.2.3.55383 > 5.6.7.8.80: Flags [.], ack 7241, win 342, options [nop,nop,TS val 4243721 ecr 4243255], length 0
14:55:23.062129 IP 5.6.7.8.80 > 1.1.2.3.55383: Flags [P.], seq 7241:11821, ack 115, win 227, options [nop,nop,TS val 4243255 ecr 4243721], length 4580
14:55:23.062143 IP 1.1.2.3.55383 > 5.6.7.8.80: Flags [.], ack 11821, win 413, options [nop,nop,TS val 4243721 ecr 4243255], length 0
14:55:23.067930 IP 1.1.2.3.55383 > 5.6.7.8.80: Flags [F.], seq 115, ack 11821, win 413, options [nop,nop,TS val 4243723 ecr 4243255], length 0
14:55:23.068413 IP 5.6.7.8.80 > 1.1.2.3.55383: Flags [F.], seq 11821, ack 116, win 227, options [nop,nop,TS val 4243256 ecr 4243723], length 0
14:55:23.068430 IP 1.1.2.3.55383 > 5.6.7.8.80: Flags [.], ack 11822, win 413, options [nop,nop,TS val 4243723 ecr 4243256], length 0
14:55:24.082549 IP 1.1.2.3.55384 > 5.6.7.8.80: Flags [S], seq 2773398400, win 29200, options [mss 1460,sackOK,TS val 4243976 ecr 0,nop,wscale 7], length 0
14:55:24.082793 IP 5.6.7.8.80 > 1.1.2.3.55384: Flags [S.], seq 2606275976, ack 2773398401, win 28960, options [mss 1460,sackOK,TS val 4243510 ecr 4243976,nop,wscale 7], length 0
14:55:24.082819 IP 1.1.2.3.55384 > 5.6.7.8.80: Flags [.], ack 1, win 229, options [nop,nop,TS val 4243976 ecr 4243510], length 0
14:55:24.082938 IP 1.1.2.3.55384 > 5.6.7.8.80: Flags [P.], seq 1:115, ack 1, win 229, options [nop,nop,TS val 4243976 ecr 4243510], length 114
14:55:24.083143 IP 5.6.7.8.80 > 1.1.2.3.55384: Flags [.], ack 115, win 227, options [nop,nop,TS val 4243510 ecr 4243976], length 0
14:55:24.083497 IP 5.6.7.8.80 > 1.1.2.3.55384: Flags [.], seq 1:5793, ack 115, win 227, options [nop,nop,TS val 4243510 ecr 4243976], length 5792
14:55:24.083516 IP 1.1.2.3.55384 > 5.6.7.8.80: Flags [.], ack 5793, win 319, options [nop,nop,TS val 4243977 ecr 4243510], length 0
14:55:24.083549 IP 5.6.7.8.80 > 1.1.2.3.55384: Flags [P.], seq 5793:11821, ack 115, win 227, options [nop,nop,TS val 4243510 ecr 4243976], length 6028
14:55:24.083567 IP 1.1.2.3.55384 > 5.6.7.8.80: Flags [.], ack 11821, win 413, options [nop,nop,TS val 4243977 ecr 4243510], length 0
14:55:24.089257 IP 1.1.2.3.55384 > 5.6.7.8.80: Flags [F.], seq 115, ack 11821, win 413, options [nop,nop,TS val 4243978 ecr 4243510], length 0
14:55:24.089833 IP 5.6.7.8.80 > 1.1.2.3.55384: Flags [F.], seq 11821, ack 116, win 227, options [nop,nop,TS val 4243512 ecr 4243978], length 0
14:55:24.089853 IP 1.1.2.3.55384 > 5.6.7.8.80: Flags [.], ack 11822, win 413, options [nop,nop,TS val 4243978 ecr 4243512], length 0
14:55:25.108192 IP 1.1.2.3.55385 > 5.6.7.8.80: Flags [S], seq 1459063334, win 29200, options [mss 1460,sackOK,TS val 4244233 ecr 0,nop,wscale 7], length 0
14:55:25.108412 IP 5.6.7.8.80 > 1.1.2.3.55385: Flags [S.], seq 1726026160, ack 1459063335, win 28960, options [mss 1460,sackOK,TS val 4243766 ecr 4244233,nop,wscale 7], length 0
14:55:25.108440 IP 1.1.2.3.55385 > 5.6.7.8.80: Flags [.], ack 1, win 229, options [nop,nop,TS val 4244233 ecr 4243766], length 0
14:55:25.108558 IP 1.1.2.3.55385 > 5.6.7.8.80: Flags [P.], seq 1:115, ack 1, win 229, options [nop,nop,TS val 4244233 ecr 4243766], length 114
14:55:25.108761 IP 5.6.7.8.80 > 1.1.2.3.55385: Flags [.], ack 115, win 227, options [nop,nop,TS val 4243766 ecr 4244233], length 0
14:55:25.109064 IP 5.6.7.8.80 > 1.1.2.3.55385: Flags [.], seq 1:4345, ack 115, win 227, options [nop,nop,TS val 4243766 ecr 4244233], length 4344
14:55:25.109084 IP 1.1.2.3.55385 > 5.6.7.8.80: Flags [.], ack 4345, win 296, options [nop,nop,TS val 4244233 ecr 4243766], length 0
14:55:25.109121 IP 5.6.7.8.80 > 1.1.2.3.55385: Flags [.], seq 4345:10137, ack 115, win 227, options [nop,nop,TS val 4243766 ecr 4244233], length 5792
14:55:25.109138 IP 1.1.2.3.55385 > 5.6.7.8.80: Flags [.], ack 10137, win 387, options [nop,nop,TS val 4244233 ecr 4243766], length 0
14:55:25.109175 IP 5.6.7.8.80 > 1.1.2.3.55385: Flags [P.], seq 10137:11821, ack 115, win 227, options [nop,nop,TS val 4243766 ecr 4244233], length 1684
14:55:25.109190 IP 1.1.2.3.55385 > 5.6.7.8.80: Flags [.], ack 11821, win 413, options [nop,nop,TS val 4244233 ecr 4243766], length 0
14:55:25.114807 IP 1.1.2.3.55385 > 5.6.7.8.80: Flags [F.], seq 115, ack 11821, win 413, options [nop,nop,TS val 4244234 ecr 4243766], length 0
14:55:25.115401 IP 5.6.7.8.80 > 1.1.2.3.55385: Flags [F.], seq 11821, ack 116, win 227, options [nop,nop,TS val 4243768 ecr 4244234], length 0
14:55:25.115421 IP 1.1.2.3.55385 > 5.6.7.8.80: Flags [.], ack 11822, win 413, options [nop,nop,TS val 4244235 ecr 4243768], length 0
14:55:26.129339 IP 1.1.2.3.55386 > 5.6.7.8.80: Flags [S], seq 50162448, win 29200, options [mss 1460,sackOK,TS val 4244488 ecr 0,nop,wscale 7], length 0
14:55:26.129587 IP 5.6.7.8.80 > 1.1.2.3.55386: Flags [S.], seq 3643683181, ack 50162449, win 28960, options [mss 1460,sackOK,TS val 4244021 ecr 4244488,nop,wscale 7], length 0
14:55:26.129618 IP 1.1.2.3.55386 > 5.6.7.8.80: Flags [.], ack 1, win 229, options [nop,nop,TS val 4244488 ecr 4244021], length 0
14:55:26.129740 IP 1.1.2.3.55386 > 5.6.7.8.80: Flags [P.], seq 1:115, ack 1, win 229, options [nop,nop,TS val 4244488 ecr 4244021], length 114
14:55:26.129936 IP 5.6.7.8.80 > 1.1.2.3.55386: Flags [.], ack 115, win 227, options [nop,nop,TS val 4244022 ecr 4244488], length 0
14:55:26.130185 IP 5.6.7.8.80 > 1.1.2.3.55386: Flags [.], seq 1:1449, ack 115, win 227, options [nop,nop,TS val 4244022 ecr 4244488], length 1448
14:55:26.130196 IP 1.1.2.3.55386 > 5.6.7.8.80: Flags [.], ack 1449, win 251, options [nop,nop,TS val 4244488 ecr 4244022], length 0
14:55:26.130251 IP 5.6.7.8.80 > 1.1.2.3.55386: Flags [.], seq 1449:7241, ack 115, win 227, options [nop,nop,TS val 4244022 ecr 4244488], length 5792
14:55:26.130276 IP 1.1.2.3.55386 > 5.6.7.8.80: Flags [.], ack 7241, win 342, options [nop,nop,TS val 4244488 ecr 4244022], length 0
14:55:26.130342 IP 5.6.7.8.80 > 1.1.2.3.55386: Flags [P.], seq 7241:11821, ack 115, win 227, options [nop,nop,TS val 4244022 ecr 4244488], length 4580
14:55:26.130366 IP 1.1.2.3.55386 > 5.6.7.8.80: Flags [.], ack 11821, win 413, options [nop,nop,TS val 4244488 ecr 4244022], length 0
14:55:26.136822 IP 1.1.2.3.55386 > 5.6.7.8.80: Flags [F.], seq 115, ack 11821, win 413, options [nop,nop,TS val 4244490 ecr 4244022], length 0
14:55:26.137325 IP 5.6.7.8.80 > 1.1.2.3.55386: Flags [F.], seq 11821, ack 116, win 227, options [nop,nop,TS val 4244023 ecr 4244490], length 0
14:55:26.137344 IP 1.1.2.3.55386 > 5.6.7.8.80: Flags [.], ack 11822, win 413, options [nop,nop,TS val 4244490 ecr 4244023], length 0
14:55:27.151109 IP 1.1.2.3.55387 > 5.6.7.8.80: Flags [S], seq 2981224763, win 29200, options [mss 1460,sackOK,TS val 4244743 ecr 0,nop,wscale 7], length 0
14:55:27.151360 IP 5.6.7.8.80 > 1.1.2.3.55387: Flags [S.], seq 730453526, ack 2981224764, win 28960, options [mss 1460,sackOK,TS val 4244277 ecr 4244743,nop,wscale 7], length 0
14:55:27.151390 IP 1.1.2.3.55387 > 5.6.7.8.80: Flags [.], ack 1, win 229, options [nop,nop,TS val 4244744 ecr 4244277], length 0
14:55:27.151510 IP 1.1.2.3.55387 > 5.6.7.8.80: Flags [P.], seq 1:115, ack 1, win 229, options [nop,nop,TS val 4244744 ecr 4244277], length 114
14:55:27.151660 IP 5.6.7.8.80 > 1.1.2.3.55387: Flags [.], ack 115, win 227, options [nop,nop,TS val 4244277 ecr 4244744], length 0
14:55:27.151962 IP 5.6.7.8.80 > 1.1.2.3.55387: Flags [.], seq 1:2897, ack 115, win 227, options [nop,nop,TS val 4244277 ecr 4244744], length 2896
14:55:27.151974 IP 1.1.2.3.55387 > 5.6.7.8.80: Flags [.], ack 2897, win 274, options [nop,nop,TS val 4244744 ecr 4244277], length 0
14:55:27.152023 IP 5.6.7.8.80 > 1.1.2.3.55387: Flags [.], seq 2897:10137, ack 115, win 227, options [nop,nop,TS val 4244277 ecr 4244744], length 7240
14:55:27.152047 IP 1.1.2.3.55387 > 5.6.7.8.80: Flags [.], ack 10137, win 387, options [nop,nop,TS val 4244744 ecr 4244277], length 0
14:55:27.152113 IP 5.6.7.8.80 > 1.1.2.3.55387: Flags [P.], seq 10137:11821, ack 115, win 227, options [nop,nop,TS val 4244277 ecr 4244744], length 1684
14:55:27.152132 IP 1.1.2.3.55387 > 5.6.7.8.80: Flags [.], ack 11821, win 413, options [nop,nop,TS val 4244744 ecr 4244277], length 0
14:55:27.157646 IP 1.1.2.3.55387 > 5.6.7.8.80: Flags [F.], seq 115, ack 11821, win 413, options [nop,nop,TS val 4244745 ecr 4244277], length 0
14:55:27.158048 IP 5.6.7.8.80 > 1.1.2.3.55387: Flags [F.], seq 11821, ack 116, win 227, options [nop,nop,TS val 4244279 ecr 4244745], length 0
14:55:27.158071 IP 1.1.2.3.55387 > 5.6.7.8.80: Flags [.], ack 11822, win 413, options [nop,nop,TS val 4244745 ecr 4244279], length 0
14:55:28.173059 IP 1.1.2.3.55388 > 5.6.7.8.80: Flags [S], seq 3142161919, win 29200, options [mss 1460,sackOK,TS val 4244999 ecr 0,nop,wscale 7], length 0
